sentence,pseudo_that,matrix_verb_to_cc,verb,verb_in_text,comp_type,context,context_verb,context_verb_n,embedded_n_sum,verb_sum
"In a 1999 interview , Nesbitt said , "" I had the necessary in my head , but I just couldn 't be bothered.","In a 1999 interview , Nesbitt said , "" I had the necessary in my head , but I just couldn 't be bothered.",0,say,said,none,"In a 1999 interview , Nesbitt","In a 1999 interview , Nesbitt said","In a 1999 interview , Nesbitt said , "" I had the",26.33091491,2.262155533
"His father suggested that he should move to England if he wanted to continue acting , so Nesbitt enrolled at the Central School of Speech and Drama ( CSSD ) , part of University of London.","His father suggested he should move to England if he wanted to continue acting , so Nesbitt enrolled at the Central School of Speech and Drama ( CSSD ) , part of University of London.",0,suggest,suggested,that,His father,His father suggested,His father suggested he should move to England,19.80283368,10.87322664
"Roger Malone in The Stage and Television Today wrote that Nesbitt "" steals the show with the best lines and best delivery as he laconically squares up to life with an easy contentment "".","Roger Malone in The Stage and Television Today wrote Nesbitt "" steals the show with the best lines and best delivery as he laconically squares up to life with an easy contentment "".",0,write,wrote,that,Roger Malone in The Stage and Television Today,Roger Malone in The Stage and Television Today wrote,"Roger Malone in The Stage and Television Today wrote Nesbitt "" steals the show",59.47641953,11.77960777
"He recalled that the play received "" shocking "" reviews , but was exciting.","He recalled the play received "" shocking "" reviews , but was exciting.",0,recall,recalled,that,He,He recalled,"He recalled the play received "" shocking",56.55134726,12.93625259
"A New York Times critic wrote , "" the jaunty , bemused Mr. Nesbitt , manages to combine soulfulness with sly humor "".","A New York Times critic wrote , "" the jaunty , bemused Mr. Nesbitt , manages to combine soulfulness with sly humor "".",0,write,wrote,that,A New York Times critic,A New York Times critic wrote,"A New York Times critic wrote , "" the jaunty ,",52.83832439,5.442559719
"The praise he received made him self @-@ assured and complacent ; in 2001 , he recalled , "" When I did Hear My Song , I disappeared so far up my own arse afterwards.","The praise he received made him self @-@ assured and complacent ; in 2001 , he recalled , "" When I did Hear My Song , I disappeared so far up my own arse afterwards.",0,recall,recalled,none,"The praise he received made him self @-@ assured and complacent ; in 2001 , he","The praise he received made him self @-@ assured and complacent ; in 2001 , he recalled","The praise he received made him self @-@ assured and complacent ; in 2001 , he recalled , "" When I did",24.01633859,11.89059985
"I thought , ' Oh , that 's it , I 've cracked it.","I thought , ' Oh , that 's it , I 've cracked it.",0,think,thought,none,I,I thought,"I thought , ' Oh , that",37.60944939,7.448469639
"' And I 'm glad that happened , because you then find out how expendable actors are.","' And I 'm glad that happened , because you then find out how expendable actors are.",1,find,find,other,"' And I 'm glad that happened , because you then","' And I 'm glad that happened , because you then find","' And I 'm glad that happened , because you then find out how expendable actors are.",45.3804009,8.990434647
"A Guardian journalist wrote that "" he showed himself to be a generous supporting actor "" in Jude and Sarajevo.","A Guardian journalist wrote "" he showed himself to be a generous supporting actor "" in Jude and Sarajevo.",0,write,wrote,that,A Guardian journalist,A Guardian journalist wrote,"A Guardian journalist wrote "" he showed himself to",42.8454417,8.28649807
"By the time of the third series , Nesbitt and the other cast members were able to influence the show 's production ; an episode featuring Adam 's stag weekend was due to be filmed on location in Dublin but Nesbitt suggested it be filmed in Belfast and Portrush instead.","By the time of the third series , Nesbitt and the other cast members were able to influence the show 's production ; an episode featuring Adam 's stag weekend was due to be filmed on location in Dublin but Nesbitt suggested it be filmed in Belfast and Portrush instead.",0,suggest,suggested,none,"By the time of the third series , Nesbitt and the other cast members were able to influence the show 's production ; an episode featuring Adam 's stag weekend was due to be filmed on location in Dublin but Nesbitt","By the time of the third series , Nesbitt and the other cast members were able to influence the show 's production ; an episode featuring Adam 's stag weekend was due to be filmed on location in Dublin but Nesbitt suggested","By the time of the third series , Nesbitt and the other cast members were able to influence the show 's production ; an episode featuring Adam 's stag weekend was due to be filmed on location in Dublin but Nesbitt suggested it be filmed in Belfast",15.58617766,8.490652084
"Executive producer Andy Harries persuaded him to stay for one more series by suggesting that Adam be killed off , so Nesbitt signed on for the fifth series.","Executive producer Andy Harries persuaded him to stay for one more series by suggesting Adam be killed off , so Nesbitt signed on for the fifth series.",0,suggest,suggesting,that,Executive producer Andy Harries persuaded him to stay for one more series by,Executive producer Andy Harries persuaded him to stay for one more series by suggesting,"Executive producer Andy Harries persuaded him to stay for one more series by suggesting Adam be killed off ,",46.27361894,9.501938701
"On preparing for the role , Nesbitt said , "" Short of robbing a bank there wasn 't much research I could have done but we did spend a day in Wandsworth Prison and that showed the nightmare monotony of prisoners ' lives.","On preparing for the role , Nesbitt said , "" Short of robbing a bank there wasn 't much research I could have done but we did spend a day in Wandsworth Prison and that showed the nightmare monotony of prisoners ' lives.",0,say,said,none,"On preparing for the role , Nesbitt","On preparing for the role , Nesbitt said","On preparing for the role , Nesbitt said , "" Short of robbing",45.46085227,4.742318153
I didn 't interview any of the inmates because I thought it would be a little patronising as it was research for a comedy and also because we were going home every night in our fancy cars to sleep in our fancy hotels.,I didn 't interview any of the inmates because I thought it would be a little patronising as it was research for a comedy and also because we were going home every night in our fancy cars to sleep in our fancy hotels.,0,think,thought,none,I didn 't interview any of the inmates because I,I didn 't interview any of the inmates because I thought,I didn 't interview any of the inmates because I thought it would be a little,12.03869915,4.361174583
"Nesbitt was only seven years old when the shootings happened and was ignorant of its cause ; he believed that there was "" no smoke without fire "" and that the Catholic marchers must have done something to provoke the British Army.","Nesbitt was only seven years old when the shootings happened and was ignorant of its cause ; he believed there was "" no smoke without fire "" and that the Catholic marchers must have done something to provoke the British Army.",0,believe,believed,that,Nesbitt was only seven years old when the shootings happened and was ignorant of its cause ; he,Nesbitt was only seven years old when the shootings happened and was ignorant of its cause ; he believed,"Nesbitt was only seven years old when the shootings happened and was ignorant of its cause ; he believed there was "" no smoke",31.6481511,6.954649448
"He read it and found that had "" an extraordinary effect "" on him.","He read it and found that had "" an extraordinary effect "" on him.",0,find,found,none,He read it and,He read it and found,"He read it and found that had "" an extraordinary",46.22218323,7.765049458
"Greengrass compared Nesbitt 's preparation to an athlete preparing for a race , and told The Observer , "" For an Irish actor , doing the Troubles is like doing Lear.","Greengrass compared Nesbitt 's preparation to an athlete preparing for a race , and told The Observer , "" For an Irish actor , doing the Troubles is like doing Lear.",0,tell,told,none,"Greengrass compared Nesbitt 's preparation to an athlete preparing for a race , and","Greengrass compared Nesbitt 's preparation to an athlete preparing for a race , and told","Greengrass compared Nesbitt 's preparation to an athlete preparing for a race , and told The Observer , "" For",29.32194585,8.256965876
"The broadcast on ITV in January 2002 and its promotion did not pass without incident ; he was criticised by Unionists for saying that Protestants in Northern Ireland felt "" a collective guilt "" over the killings.","The broadcast on ITV in January 2002 and its promotion did not pass without incident ; he was criticised by Unionists for saying Protestants in Northern Ireland felt "" a collective guilt "" over the killings.",0,say,saying,that,The broadcast on ITV in January 2002 and its promotion did not pass without incident ; he was criticised by Unionists for,The broadcast on ITV in January 2002 and its promotion did not pass without incident ; he was criticised by Unionists for saying,The broadcast on ITV in January 2002 and its promotion did not pass without incident ; he was criticised by Unionists for saying Protestants in Northern Ireland felt,34.59590285,5.415397227
"In an analysis of the film in the History & Memory journal , Aileen Blaney wrote that it is Nesbitt 's real @-@ life household name status that made his portrayal of Cooper such a success.","In an analysis of the film in the History & Memory journal , Aileen Blaney wrote it is Nesbitt 's real @-@ life household name status that made his portrayal of Cooper such a success.",0,write,wrote,that,"In an analysis of the film in the History & Memory journal , Aileen Blaney","In an analysis of the film in the History & Memory journal , Aileen Blaney wrote","In an analysis of the film in the History & Memory journal , Aileen Blaney wrote it is Nesbitt 's real",61.38164562,5.211789608
"She reasoned that Nesbitt 's celebrity status mirrors that of Cooper 's in the 1970s : "" A household name across Great Britain , Northern Ireland and the Irish Republic [ sic ] , Nesbitt 's widespread popular appeal is emphatically not contingent upon his Protestant Ulster identity , and consequently the double @-@ voicing of the character he plays does not alienate viewers of an alternative , or no , sectarian persuasion.","She reasoned Nesbitt 's celebrity status mirrors that of Cooper 's in the 1970s : "" A household name across Great Britain , Northern Ireland and the Irish Republic [ sic ] , Nesbitt 's widespread popular appeal is emphatically not contingent upon his Protestant Ulster identity , and consequently the double @-@ voicing of the character he plays does not alienate viewers of an alternative , or no , sectarian persuasion.",0,reason,reasoned,that,She,She reasoned,She reasoned Nesbitt 's celebrity status mirrors,71.2799297,15.03373337
""" Guardian journalist Susie Steiner suggested that his appearance in Bloody Sunday was an attempt to resolve the expression of his "" Irishness "" on screen : "" Where he has taken part in a sectarian theme , his intelligence as an actor has often been masked by an excessive , cartoon @-@ style comedy.",""" Guardian journalist Susie Steiner suggested his appearance in Bloody Sunday was an attempt to resolve the expression of his "" Irishness "" on screen : "" Where he has taken part in a sectarian theme , his intelligence as an actor has often been masked by an excessive , cartoon @-@ style comedy.",0,suggest,suggested,that,""" Guardian journalist Susie Steiner",""" Guardian journalist Susie Steiner suggested",""" Guardian journalist Susie Steiner suggested his appearance in Bloody Sunday",41.33604088,10.5843811
"After the broadcast of the pilot , Guardian critic Gareth McLean wrote , "" the likeable James Nesbitt turned in a strong , extremely watchable central performance , though rarely did he look taxed by his efforts , and his chemistry with [ Claudia ] Harrison was promising and occasionally electric.","After the broadcast of the pilot , Guardian critic Gareth McLean wrote , "" the likeable James Nesbitt turned in a strong , extremely watchable central performance , though rarely did he look taxed by his efforts , and his chemistry with [ Claudia ] Harrison was promising and occasionally electric.",0,write,wrote,none,"After the broadcast of the pilot , Guardian critic Gareth McLean","After the broadcast of the pilot , Guardian critic Gareth McLean wrote","After the broadcast of the pilot , Guardian critic Gareth McLean wrote , "" the likeable James",45.20999122,3.470790863
"He was made a creative consultant and suggested that Murphy keep one undercover role for a full series , instead of changing into a new guise every episode.","He was made a creative consultant and suggested Murphy keep one undercover role for a full series , instead of changing into a new guise every episode.",0,suggest,suggested,that,He was made a creative consultant and,He was made a creative consultant and suggested,He was made a creative consultant and suggested Murphy keep one undercover role,61.65592027,12.60968924
"After the first new episode was broadcast , Sarah Vine wrote in The Times , "" In the past , when attempting a nasty stare or a hard face , Nesbitt has never managed much more than a faintly quizzical look , hilarity forever threatening to break out behind those twinkly Irish eyes.","After the first new episode was broadcast , Sarah Vine wrote in The Times , "" In the past , when attempting a nasty stare or a hard face , Nesbitt has never managed much more than a faintly quizzical look , hilarity forever threatening to break out behind those twinkly Irish eyes.",0,write,wrote,none,"After the first new episode was broadcast , Sarah Vine","After the first new episode was broadcast , Sarah Vine wrote","After the first new episode was broadcast , Sarah Vine wrote in The Times , """,19.98102039,7.505178452
"But , once he has made a wrong decision , he can 't control everything in his life , as he thinks he is weak.","But , once he has made a wrong decision , he can 't control everything in his life , as he thinks he is weak.",0,think,thinks,none,"But , once he has made a wrong decision , he can 't control everything in his life , as he","But , once he has made a wrong decision , he can 't control everything in his life , as he thinks","But , once he has made a wrong decision , he can 't control everything in his life , as he thinks he is weak.",19.54589295,6.286928654
"Nesbitt 's character appears at the end of the film and he read only that part of the script , so did not know the full circumstances of the crime Banner investigates.","Nesbitt 's character appears at the end of the film and he read only that part of the script , so did not know the full circumstances of the crime Banner investigates.",0,know,know,none,"Nesbitt 's character appears at the end of the film and he read only that part of the script , so did not","Nesbitt 's character appears at the end of the film and he read only that part of the script , so did not know","Nesbitt 's character appears at the end of the film and he read only that part of the script , so did not know the full circumstances of the",23.72345638,2.611552715
"In The Independent , Michael Coveney suggested the role did not fit the actor : "" Nesbitt is cool.","In The Independent , Michael Coveney suggested the role did not fit the actor : "" Nesbitt is cool.",0,suggest,suggested,none,"In The Independent , Michael Coveney","In The Independent , Michael Coveney suggested","In The Independent , Michael Coveney suggested the role did not fit",34.73900023,11.30487858
But I never felt that he was inside his role of a chap called Socrates [ ... ] He grinned and shrugged through the evening which steadily became less about grouting on tiles and more about grating on nerves.,But I never felt he was inside his role of a chap called Socrates [ ... ] He grinned and shrugged through the evening which steadily became less about grouting on tiles and more about grating on nerves.,0,feel,felt,that,But I never,But I never felt,But I never felt he was inside his role,37.10793579,5.899549961
"He was pleased to learn that the serial was being produced by Nigel Stafford @-@ Clark , whose Bleak House adaptation he had enjoyed , and that he would be appearing with his Jekyll co @-@ star Denis Lawson.","He was pleased to learn the serial was being produced by Nigel Stafford @-@ Clark , whose Bleak House adaptation he had enjoyed , and that he would be appearing with his Jekyll co @-@ star Denis Lawson.",0,learn,learn,that,He was pleased to,He was pleased to learn,He was pleased to learn the serial was being produced,37.3408798,4.272988796
"Nesbitt said , "" The role of Peter is what I have dreamed about playing , you wait your whole life for an opportunity like this and when it comes you have to grab it.","Nesbitt said , "" The role of Peter is what I have dreamed about playing , you wait your whole life for an opportunity like this and when it comes you have to grab it.",0,say,said,none,Nesbitt,Nesbitt said,"Nesbitt said , "" The role of",32.53973466,5.534687519
"Both performances were commended by Independent journalist Hugh Montgomery ; in a review of 2009 's television , Montgomery named Nesbitt "" Face of the Year "" , writing , "" Just as you had James Nesbitt written off as the gurning embodiment of everything mediocre about British TV drama , he produced two stonking performances , as the transfixingly harrowed sergeant in Occupation , and a nervily vengeful victim 's relative in Irish @-@ troubles piece Five Minutes of Heaven.","Both performances were commended by Independent journalist Hugh Montgomery ; in a review of 2009 's television , Montgomery named Nesbitt "" Face of the Year "" , writing , "" Just as you had James Nesbitt written off as the gurning embodiment of everything mediocre about British TV drama , he produced two stonking performances , as the transfixingly harrowed sergeant in Occupation , and a nervily vengeful victim 's relative in Irish @-@ troubles piece Five Minutes of Heaven.",0,write,writing,none,"Both performances were commended by Independent journalist Hugh Montgomery ; in a review of 2009 's television , Montgomery named Nesbitt "" Face of the Year "" ,","Both performances were commended by Independent journalist Hugh Montgomery ; in a review of 2009 's television , Montgomery named Nesbitt "" Face of the Year "" , writing","Both performances were commended by Independent journalist Hugh Montgomery ; in a review of 2009 's television , Montgomery named Nesbitt "" Face of the Year "" , writing , "" Just as you",28.61673115,6.321700573
"Times writer Andrew Billen noted that the adverts "" cost him some credibility "" but Nesbitt was pleased with the money he made from them.","Times writer Andrew Billen noted the adverts "" cost him some credibility "" but Nesbitt was pleased with the money he made from them.",0,note,noted,that,Times writer Andrew Billen,Times writer Andrew Billen noted,"Times writer Andrew Billen noted the adverts "" cost him",51.03241205,9.746739388
"Shortly afterwards , another tabloid story revealed an affair with a prostitute , who claimed Nesbitt had boasted of liaisons with his Cold Feet co @-@ star Kimberley Joseph , and Amanda Brunker , a former Miss Ireland.","Shortly afterwards , another tabloid story revealed an affair with a prostitute , who claimed Nesbitt had boasted of liaisons with his Cold Feet co @-@ star Kimberley Joseph , and Amanda Brunker , a former Miss Ireland.",0,claim,claimed,none,"Shortly afterwards , another tabloid story revealed an affair with a prostitute , who","Shortly afterwards , another tabloid story revealed an affair with a prostitute , who claimed","Shortly afterwards , another tabloid story revealed an affair with a prostitute , who claimed Nesbitt had boasted of liaisons",49.37707005,4.1818856
"Commenting on the publication of details about his personal life , Nesbitt has said he feared that he would lose his marriage , though the exposing of his "" dual life "" allowed him to "" take a long and considered look "" at himself.","Commenting on the publication of details about his personal life , Nesbitt has said he feared that he would lose his marriage , though the exposing of his "" dual life "" allowed him to "" take a long and considered look "" at himself.",0,say,said,none,"Commenting on the publication of details about his personal life , Nesbitt has","Commenting on the publication of details about his personal life , Nesbitt has said","Commenting on the publication of details about his personal life , Nesbitt has said he feared that he would",20.90513813,1.86484611
"Commenting on the publication of details about his personal life , Nesbitt has said he feared that he would lose his marriage , though the exposing of his "" dual life "" allowed him to "" take a long and considered look "" at himself.","Commenting on the publication of details about his personal life , Nesbitt has said he feared he would lose his marriage , though the exposing of his "" dual life "" allowed him to "" take a long and considered look "" at himself.",0,fear,feared,that,"Commenting on the publication of details about his personal life , Nesbitt has said he","Commenting on the publication of details about his personal life , Nesbitt has said he feared","Commenting on the publication of details about his personal life , Nesbitt has said he feared he would lose his marriage",18.58759081,9.970562935
"In October 2013 , Nesbitt announced that he and his wife Sonia Forbes @-@ Adam would separate from each other after 19 years.","In October 2013 , Nesbitt announced he and his wife Sonia Forbes @-@ Adam would separate from each other after 19 years.",0,announce,announced,that,"In October 2013 , Nesbitt","In October 2013 , Nesbitt announced","In October 2013 , Nesbitt announced he and his wife Sonia",28.54862523,7.148381051
The couple says that the filming of The Hobbit Trilogy has forced the couple to live separately for the past two years.,The couple says the filming of The Hobbit Trilogy has forced the couple to live separately for the past two years.,0,say,says,that,The couple,The couple says,The couple says the filming of The Hobbit,29.97730601,8.260474205
The split came as a mutual decision and the couple says that infidelity was not one of the reasons for their decision.,The split came as a mutual decision and the couple says infidelity was not one of the reasons for their decision.,0,say,says,that,The split came as a mutual decision and the couple,The split came as a mutual decision and the couple says,The split came as a mutual decision and the couple says infidelity was not one of,31.22496542,8.75790596
"Following his official installation on 8 June 2010 , Nesbitt said , "" Rather than being just an informal role officiating at ceremonies , I think I can act as an ambassador.","Following his official installation on 8 June 2010 , Nesbitt said , "" Rather than being just an informal role officiating at ceremonies , I think I can act as an ambassador.",0,say,said,none,"Following his official installation on 8 June 2010 , Nesbitt","Following his official installation on 8 June 2010 , Nesbitt said","Following his official installation on 8 June 2010 , Nesbitt said , "" Rather than being",33.49959502,6.272266269
"Following his official installation on 8 June 2010 , Nesbitt said , "" Rather than being just an informal role officiating at ceremonies , I think I can act as an ambassador.","Following his official installation on 8 June 2010 , Nesbitt said , "" Rather than being just an informal role officiating at ceremonies , I think I can act as an ambassador.",0,think,think,none,"Following his official installation on 8 June 2010 , Nesbitt said , "" Rather than being just an informal role officiating at ceremonies , I","Following his official installation on 8 June 2010 , Nesbitt said , "" Rather than being just an informal role officiating at ceremonies , I think","Following his official installation on 8 June 2010 , Nesbitt said , "" Rather than being just an informal role officiating at ceremonies , I think I can act as an",20.35428044,4.195608616
"I believe I can bring something to that , otherwise I wouldn 't have taken this on.","I believe I can bring something to that , otherwise I wouldn 't have taken this on.",0,believe,believe,none,I,I believe,I believe I can bring something to,24.52302027,7.265545845
"When Harrison first played the beat to his friends , they could not "" dig it "" , and this made him realize that he had conceived something special , which people would appreciate better after hearing the whole record.","When Harrison first played the beat to his friends , they could not "" dig it "" , and this made him realize he had conceived something special , which people would appreciate better after hearing the whole record.",0,realize,realize,that,"When Harrison first played the beat to his friends , they could not "" dig it "" , and this made him","When Harrison first played the beat to his friends , they could not "" dig it "" , and this made him realize","When Harrison first played the beat to his friends , they could not "" dig it "" , and this made him realize he had conceived something special",34.58933878,5.480985641
