sentence,pseudo_that,context,embedded_clause,matrix_verb_to_cc,verb,verb_in_text,embedded_clause_n,comp_type,context_verb,context_verb_n,embedded_n_sum,verb_sum
"Kreeft explains that the Church regards them as "" a path of life "" , and a "" path to freedom "" just as a schoolyard fence protects children from "" life @-@ threatening dangers "".","Kreeft explains the Church regards them as "" a path of life "" , and a "" path to freedom "" just as a schoolyard fence protects children from "" life @-@ threatening dangers "".",Kreeft,"the Church regards them as "" a path of life "" , and a "" path to freedom "" just as a schoolyard fence protects children from "" life @-@ threatening dangers "".",0,explain,explains,Kreeft explains the Church regards them as,that,Kreeft explains,"Kreeft explains the Church regards them as "" a",55.757967948913574,13.841917991638184
"The first commandment , according to Church teaching , "" means that [ followers ] must worship and adore God alone because God is alone.","The first commandment , according to Church teaching , "" means [ followers ] must worship and adore God alone because God is alone.","The first commandment , according to Church teaching , """,[ followers ] must worship and adore God alone because God is alone.,0,mean,means,"The first commandment , according to Church teaching , "" means [ followers ] must worship",that,"The first commandment , according to Church teaching , "" means","The first commandment , according to Church teaching , "" means [ followers ] must worship and adore",56.032865749904886,12.86519718170166
""" The Catechism explains that this prohibits idolatry , providing examples of forbidden practices such as the worship of any creature , and of "" ' demons ... power , pleasure , race , ancestors , the state [ and ] money ' "".",""" The Catechism explains this prohibits idolatry , providing examples of forbidden practices such as the worship of any creature , and of "" ' demons ... power , pleasure , race , ancestors , the state [ and ] money ' "".",""" The Catechism","this prohibits idolatry , providing examples of forbidden practices such as the worship of any creature , and of "" ' demons ... power , pleasure , race , ancestors , the state [ and ] money ' "".",0,explain,explains,""" The Catechism explains this prohibits idolatry , providing",that,""" The Catechism explains",""" The Catechism explains this prohibits idolatry , providing examples of",64.9101034514606,11.047442436218262
"Explaining this sentiment , Kreeft states that all sin "" serves some other god , obeys another commander : the world or the flesh or the devil "" , if God truly be loved then one will do what God wills.","Explaining this sentiment , Kreeft states all sin "" serves some other god , obeys another commander : the world or the flesh or the devil "" , if God truly be loved then one will do what God wills.","Explaining this sentiment , Kreeft","all sin "" serves some other god , obeys another commander : the world or the flesh or the devil "" , if God truly be loved then one will do what God wills.",0,state,states,"Explaining this sentiment , Kreeft states all sin "" serves some",that,"Explaining this sentiment , Kreeft states","Explaining this sentiment , Kreeft states all sin "" serves some other god",76.33532333374023,9.027295112609863
"Explaining this sentiment , Kreeft states that all sin "" serves some other god , obeys another commander : the world or the flesh or the devil "" , if God truly be loved then one will do what God wills.","Explaining this sentiment , Kreeft states that all sin "" serves some other god , obeys another commander : the world or the flesh or the devil "" , if God truly be loved then one will do what God wills.","Explaining this sentiment , Kreeft","that all sin "" serves some other god , obeys another commander : the world or the flesh or the devil "" , if God truly be loved then one will do what God wills.",0,state,states,"Explaining this sentiment , Kreeft states that all sin "" serves",none,"Explaining this sentiment , Kreeft states","Explaining this sentiment , Kreeft states that all sin "" serves some other",59.46421778202057,9.027295112609863
"While Catholics are sometimes accused of worshiping images , in violation of the first commandment , the Church says this is a misunderstanding.","While Catholics are sometimes accused of worshiping images , in violation of the first commandment , the Church says this is a misunderstanding.","While Catholics are sometimes accused of worshiping images , in violation of the first commandment , the Church",this is a misunderstanding.,0,say,says,"While Catholics are sometimes accused of worshiping images , in violation of the first commandment , the Church says this is a misunderstanding",none,"While Catholics are sometimes accused of worshiping images , in violation of the first commandment , the Church says","While Catholics are sometimes accused of worshiping images , in violation of the first commandment , the Church says this is a misunderstanding.",21.27195382118225,7.16351318359375
"At the Second Council of Nicaea in 787 , the ecumenical council determined that the veneration of icons and statues was not in violation of the commandment and stated "" whoever venerates an image venerates the person portrayed in it.","At the Second Council of Nicaea in 787 , the ecumenical council determined the veneration of icons and statues was not in violation of the commandment and stated "" whoever venerates an image venerates the person portrayed in it.","At the Second Council of Nicaea in 787 , the ecumenical council","the veneration of icons and statues was not in violation of the commandment and stated "" whoever venerates an image venerates the person portrayed in it.",0,determine,determined,"At the Second Council of Nicaea in 787 , the ecumenical council determined the veneration of icons and",that,"At the Second Council of Nicaea in 787 , the ecumenical council determined","At the Second Council of Nicaea in 787 , the ecumenical council determined the veneration of icons and statues was",46.86312701553106,10.526183128356934
"At the Second Council of Nicaea in 787 , the ecumenical council determined that the veneration of icons and statues was not in violation of the commandment and stated "" whoever venerates an image venerates the person portrayed in it.","At the Second Council of Nicaea in 787 , the ecumenical council determined that the veneration of icons and statues was not in violation of the commandment and stated "" whoever venerates an image venerates the person portrayed in it.","At the Second Council of Nicaea in 787 , the ecumenical council determined that the veneration of icons and statues was not in violation of the commandment and",""" whoever venerates an image venerates the person portrayed in it.",0,state,stated,"At the Second Council of Nicaea in 787 , the ecumenical council determined that the veneration of icons and statues was not in violation of the commandment and stated "" whoever venerates an image",none,"At the Second Council of Nicaea in 787 , the ecumenical council determined that the veneration of icons and statues was not in violation of the commandment and stated","At the Second Council of Nicaea in 787 , the ecumenical council determined that the veneration of icons and statues was not in violation of the commandment and stated "" whoever venerates an image venerates the",45.59862530231476,11.899291038513184
"It states that "" by becoming incarnate , the Son of God introduced a new economy of images "".","It states "" by becoming incarnate , the Son of God introduced a new economy of images "".",It,""" by becoming incarnate , the Son of God introduced a new economy of images "".",0,state,states,"It states "" by becoming incarnate ,",that,It states,"It states "" by becoming incarnate , the Son",63.54889389872551,14.56450080871582
"They explain that today , idolatry expresses itself in the worship of other things , and list some as "" power , money , materialism and sports.","They explain today , idolatry expresses itself in the worship of other things , and list some as "" power , money , materialism and sports.",They,"today , idolatry expresses itself in the worship of other things , and list some as "" power , money , materialism and sports.",0,explain,explain,"They explain today , idolatry expresses itself",that,They explain,"They explain today , idolatry expresses itself in the",72.82941795885563,12.254958152770996
Many ancient cultures believed that names were sacred ; some had prohibitions on when a person 's name could be spoken.,Many ancient cultures believed names were sacred ; some had prohibitions on when a person 's name could be spoken.,Many ancient cultures,names were sacred ; some had prohibitions on when a person 's name could be spoken.,0,believe,believed,Many ancient cultures believed names were sacred ; some,that,Many ancient cultures believed,Many ancient cultures believed names were sacred ; some had prohibitions,62.83014988899231,5.069566249847412
"Since they did not believe that he was God , they considered this blasphemy , which under Mosaic law carries a death penalty.","Since they did not believe he was God , they considered this blasphemy , which under Mosaic law carries a death penalty.",Since they did not,"he was God , they considered this blasphemy , which under Mosaic law carries a death penalty.",0,believe,believe,"Since they did not believe he was God , they",that,Since they did not believe,"Since they did not believe he was God , they considered this",41.33887243270874,7.7354912757873535
"Kreeft writes that all of the names by which God is known are holy , and thus all of those names are protected by the second commandment.","Kreeft writes all of the names by which God is known are holy , and thus all of those names are protected by the second commandment.",Kreeft,"all of the names by which God is known are holy , and thus all of those names are protected by the second commandment.",0,write,writes,Kreeft writes all of the names by,that,Kreeft writes,Kreeft writes all of the names by which God,55.414448976516724,13.824538230895996
"The Catechism states , "" Respect for his name is an expression of the respect owed to the mystery of God himself and to the whole sacred reality it evokes.","The Catechism states , "" Respect for his name is an expression of the respect owed to the mystery of God himself and to the whole sacred reality it evokes.",The Catechism,", "" Respect for his name is an expression of the respect owed to the mystery of God himself and to the whole sacred reality it evokes.",0,state,states,"The Catechism states , "" Respect for his",none,The Catechism states,"The Catechism states , "" Respect for his name is",45.24317288398743,8.6292085647583
"According to Pope Benedict XVI , when God revealed his name to Moses he established a relationship with mankind ; Benedict states that the Incarnation was the culmination of a process that "" had begun with the giving of the divine name.","According to Pope Benedict XVI , when God revealed his name to Moses he established a relationship with mankind ; Benedict states the Incarnation was the culmination of a process that "" had begun with the giving of the divine name.","According to Pope Benedict XVI , when God revealed his name to Moses he established a relationship with mankind ; Benedict","the Incarnation was the culmination of a process that "" had begun with the giving of the divine name.",0,state,states,"According to Pope Benedict XVI , when God revealed his name to Moses he established a relationship with mankind ; Benedict states the Incarnation was the culmination",that,"According to Pope Benedict XVI , when God revealed his name to Moses he established a relationship with mankind ; Benedict states","According to Pope Benedict XVI , when God revealed his name to Moses he established a relationship with mankind ; Benedict states the Incarnation was the culmination of a",33.97682970762253,11.4218168258667
""" Benedict elaborates that this means the divine name could be misused and that Jesus ' inclusion of "" hallowed be thy name "" is a plea for the sanctification of God 's name , to "" protect the wonderful mystery of his accessibility to us , and constantly assert his true identity as opposed to our distortion of it "".",""" Benedict elaborates that this means the divine name could be misused and that Jesus ' inclusion of "" hallowed be thy name "" is a plea for the sanctification of God 's name , to "" protect the wonderful mystery of his accessibility to us , and constantly assert his true identity as opposed to our distortion of it "".",""" Benedict elaborates that this","the divine name could be misused and that Jesus ' inclusion of "" hallowed be thy name "" is a plea for the sanctification of God 's name , to "" protect the wonderful mystery of his accessibility to us , and constantly assert his true identity as opposed to our distortion of it "".",0,mean,means,""" Benedict elaborates that this means the divine name could be",none,""" Benedict elaborates that this means",""" Benedict elaborates that this means the divine name could be misused and",49.402707159519196,7.936770915985107
"Quoting the Jewish rabbi and scholar Jacob Neusner , Pope Benedict XVI explains that to Israel , keeping this commandment was more than ritual ; it was a way to imitate God , who rested on the seventh day after the creation.","Quoting the Jewish rabbi and scholar Jacob Neusner , Pope Benedict XVI explains to Israel , keeping this commandment was more than ritual ; it was a way to imitate God , who rested on the seventh day after the creation.","Quoting the Jewish rabbi and scholar Jacob Neusner , Pope Benedict XVI","to Israel , keeping this commandment was more than ritual ; it was a way to imitate God , who rested on the seventh day after the creation.",0,explain,explains,"Quoting the Jewish rabbi and scholar Jacob Neusner , Pope Benedict XVI explains to Israel , keeping this",that,"Quoting the Jewish rabbi and scholar Jacob Neusner , Pope Benedict XVI explains","Quoting the Jewish rabbi and scholar Jacob Neusner , Pope Benedict XVI explains to Israel , keeping this commandment was",68.75479990243912,10.69825553894043
"Tertullian is the first to mention Sunday rest : "" We , however ( just as tradition has taught us ) , on the day of the Lord 's Resurrection ought to guard not only against kneeling , but every posture and office of solicitude , deferring even our businesses lest we give any place to the devil "" ( "" De orat.","Tertullian is the first to mention Sunday rest : "" We , however ( just as tradition has taught us ) , on the day of the Lord 's Resurrection ought to guard not only against kneeling , but every posture and office of solicitude , deferring even our businesses lest we give any place to the devil "" ( "" De orat.",Tertullian is the first to,"Sunday rest : "" We , however ( just as tradition has taught us ) , on the day of the Lord 's Resurrection ought to guard not only against kneeling , but every posture and office of solicitude , deferring even our businesses lest we give any place to the devil "" ( "" De orat.",0,mention,mention,"Tertullian is the first to mention Sunday rest : "" We",none,Tertullian is the first to mention,"Tertullian is the first to mention Sunday rest : "" We , however",81.03309106826782,6.018500804901123
"In the sixth century , Caesarius of Arles taught that the whole glory of the Jewish Sabbath had been transferred to Sunday and that Christians must keep Sunday in the same way as the Jews were commanded to keep the Sabbath.","In the sixth century , Caesarius of Arles taught the whole glory of the Jewish Sabbath had been transferred to Sunday and that Christians must keep Sunday in the same way as the Jews were commanded to keep the Sabbath.","In the sixth century , Caesarius of Arles",the whole glory of the Jewish Sabbath had been transferred to Sunday and that Christians must keep Sunday in the same way as the Jews were commanded to keep the Sabbath.,0,teach,taught,"In the sixth century , Caesarius of Arles taught the whole glory of the",that,"In the sixth century , Caesarius of Arles taught","In the sixth century , Caesarius of Arles taught the whole glory of the Jewish Sabbath",46.25701501965523,10.980916023254395
"For Catholics , Jesus ' teaching that "" the sabbath was made for man , not man for the sabbath "" means that good works "" when the needs of others demand it "" can be part of the day of rest.","For Catholics , Jesus ' teaching that "" the sabbath was made for man , not man for the sabbath "" means good works "" when the needs of others demand it "" can be part of the day of rest.","For Catholics , Jesus ' teaching that "" the sabbath was made for man , not man for the sabbath ""","good works "" when the needs of others demand it "" can be part of the day of rest.",0,mean,means,"For Catholics , Jesus ' teaching that "" the sabbath was made for man , not man for the sabbath "" means good works "" when the",that,"For Catholics , Jesus ' teaching that "" the sabbath was made for man , not man for the sabbath "" means","For Catholics , Jesus ' teaching that "" the sabbath was made for man , not man for the sabbath "" means good works "" when the needs of",50.397724490612745,6.207624435424805
"Pope Benedict XVI states that Rabbi Neusner "" rightly sees this commandment as anchoring the heart of the social order "".","Pope Benedict XVI states Rabbi Neusner "" rightly sees this commandment as anchoring the heart of the social order "".",Pope Benedict XVI,"Rabbi Neusner "" rightly sees this commandment as anchoring the heart of the social order "".",0,state,states,"Pope Benedict XVI states Rabbi Neusner "" rightly sees",that,Pope Benedict XVI states,"Pope Benedict XVI states Rabbi Neusner "" rightly sees this commandment",92.73900976777077,12.62182331085205
"It strengthens generational relationships , makes explicit the connection between family order and societal stability , and reveals that the family is "" both willed and protected by God.","It strengthens generational relationships , makes explicit the connection between family order and societal stability , and reveals the family is "" both willed and protected by God.","It strengthens generational relationships , makes explicit the connection between family order and societal stability , and","the family is "" both willed and protected by God.",0,reveal,reveals,"It strengthens generational relationships , makes explicit the connection between family order and societal stability , and reveals the family is "" both",that,"It strengthens generational relationships , makes explicit the connection between family order and societal stability , and reveals","It strengthens generational relationships , makes explicit the connection between family order and societal stability , and reveals the family is "" both willed and",60.24128544330597,7.59135627746582
The Catechism says this commandment requires duties of children to parents that include :.,The Catechism says this commandment requires duties of children to parents that include :.,The Catechism,this commandment requires duties of children to parents that include :.,0,say,says,The Catechism says this commandment requires duties of,none,The Catechism says,The Catechism says this commandment requires duties of children to,62.2768697142601,8.78603458404541
"Gratitude , as expressed in a quote from Sirach : "" Remember that through your parents you were born ; what can you give back to them that equals their gift to you ? "".","Gratitude , as expressed in a quote from Sirach : "" Remember through your parents you were born ; what can you give back to them that equals their gift to you ? "".","Gratitude , as expressed in a quote from Sirach : ""","through your parents you were born ; what can you give back to them that equals their gift to you ? "".",0,remember,Remember,"Gratitude , as expressed in a quote from Sirach : "" Remember through your parents you were",that,"Gratitude , as expressed in a quote from Sirach : "" Remember","Gratitude , as expressed in a quote from Sirach : "" Remember through your parents you were born ;",48.5333354473114,12.928966283798218
"The Gospel of Matthew relates that when told his mother and brothers were waiting to see him , Jesus replied , "" Who is my mother and who are my brothers ? "" Stretching his hand over his disciples he said , "" Here are my mother and my brothers ! For whoever does the will of my Father in heaven is my brother , and my sister , and mother.","The Gospel of Matthew relates that when told his mother and brothers were waiting to see him , Jesus replied , "" Who is my mother and who are my brothers ? "" Stretching his hand over his disciples he said , "" Here are my mother and my brothers ! For whoever does the will of my Father in heaven is my brother , and my sister , and mother.",The Gospel of Matthew relates that when,"his mother and brothers were waiting to see him , Jesus replied , "" Who is my mother and who are my brothers ? "" Stretching his hand over his disciples he said , "" Here are my mother and my brothers ! For whoever does the will of my Father in heaven is my brother , and my sister , and mother.",0,tell,told,The Gospel of Matthew relates that when told his mother and brothers were,none,The Gospel of Matthew relates that when told,The Gospel of Matthew relates that when told his mother and brothers were waiting to,36.97655761241913,12.930537223815918
"The Gospel of Matthew relates that when told his mother and brothers were waiting to see him , Jesus replied , "" Who is my mother and who are my brothers ? "" Stretching his hand over his disciples he said , "" Here are my mother and my brothers ! For whoever does the will of my Father in heaven is my brother , and my sister , and mother.","The Gospel of Matthew relates that when told his mother and brothers were waiting to see him , Jesus replied , "" Who is my mother and who are my brothers ? "" Stretching his hand over his disciples he said , "" Here are my mother and my brothers ! For whoever does the will of my Father in heaven is my brother , and my sister , and mother.","The Gospel of Matthew relates that when told his mother and brothers were waiting to see him , Jesus",", "" Who is my mother and who are my brothers ? "" Stretching his hand over his disciples he said , "" Here are my mother and my brothers ! For whoever does the will of my Father in heaven is my brother , and my sister , and mother.",0,reply,replied,"The Gospel of Matthew relates that when told his mother and brothers were waiting to see him , Jesus replied , "" Who is my",none,"The Gospel of Matthew relates that when told his mother and brothers were waiting to see him , Jesus replied","The Gospel of Matthew relates that when told his mother and brothers were waiting to see him , Jesus replied , "" Who is my mother and",21.725530117750168,4.581295490264893
"The Gospel of Matthew relates that when told his mother and brothers were waiting to see him , Jesus replied , "" Who is my mother and who are my brothers ? "" Stretching his hand over his disciples he said , "" Here are my mother and my brothers ! For whoever does the will of my Father in heaven is my brother , and my sister , and mother.","The Gospel of Matthew relates that when told his mother and brothers were waiting to see him , Jesus replied , "" Who is my mother and who are my brothers ? "" Stretching his hand over his disciples he said , "" Here are my mother and my brothers ! For whoever does the will of my Father in heaven is my brother , and my sister , and mother.","The Gospel of Matthew relates that when told his mother and brothers were waiting to see him , Jesus replied , "" Who is my mother and who are my brothers ? "" Stretching his hand over his disciples he",", "" Here are my mother and my brothers ! For whoever does the will of my Father in heaven is my brother , and my sister , and mother.",0,say,said,"Stretching his hand over his disciples he said , "" Here are my",none,"The Gospel of Matthew relates that when told his mother and brothers were waiting to see him , Jesus replied , "" Who is my mother and who are my brothers ? "" Stretching his hand over his disciples he said","The Gospel of Matthew relates that when told his mother and brothers were waiting to see him , Jesus replied , "" Who is my mother and who are my brothers ? "" Stretching his hand over his disciples he said , "" Here are my mother and",20.288135915994644,1.2478419542312622
""" Pope Benedict XVI stated that this dictum of Jesus brought the fourth commandment to a new and higher level.",""" Pope Benedict XVI stated this dictum of Jesus brought the fourth commandment to a new and higher level.",""" Pope Benedict XVI",this dictum of Jesus brought the fourth commandment to a new and higher level.,0,state,stated,""" Pope Benedict XVI stated this dictum of Jesus brought",that,""" Pope Benedict XVI stated",""" Pope Benedict XVI stated this dictum of Jesus brought the fourth",64.0068428516388,10.901525497436523
"The Catechism states : "" Human life is sacred because from its beginning it involves the creative action of God and it remains forever in a special relationship with the Creator , who is its sole end.","The Catechism states : "" Human life is sacred because from its beginning it involves the creative action of God and it remains forever in a special relationship with the Creator , who is its sole end.",The Catechism,": "" Human life is sacred because from its beginning it involves the creative action of God and it remains forever in a special relationship with the Creator , who is its sole end.",0,state,states,"The Catechism states : "" Human life is",none,The Catechism states,"The Catechism states : "" Human life is sacred because",40.42782515287399,8.6292085647583
