sentence,pseudo_that,matrix_verb_to_cc,verb,verb_in_text,comp_type,context,context_verb,context_verb_n,embedded_n_sum,verb_sum
"The investigation reviewed "" hundreds "" of pages of internal documents and interviewed "" more than a dozen "" former and current staff members , and investigated the organization 's claim that 4 @.@ 5 million Haitians had been helped "" back on their feet "" despite Joel Boutroue , a Haitian government advisor , stating that this number would cover "" 100 percent of the urban area "" , and observing that this would mean they had served every city in Haiti.","The investigation reviewed "" hundreds "" of pages of internal documents and interviewed "" more than a dozen "" former and current staff members , and investigated the organization 's claim that 4 @.@ 5 million Haitians had been helped "" back on their feet "" despite Joel Boutroue , a Haitian government advisor , stating that this number would cover "" 100 percent of the urban area "" , and observing that this would mean they had served every city in Haiti.",0,mean,mean,none,"The investigation reviewed "" hundreds "" of pages of internal documents and interviewed "" more than a dozen "" former and current staff members , and investigated the organization 's claim that 4 @.@ 5 million Haitians had been helped "" back on their feet "" despite Joel Boutroue , a Haitian government advisor , stating that this number would cover "" 100 percent of the urban area "" , and observing that this would","The investigation reviewed "" hundreds "" of pages of internal documents and interviewed "" more than a dozen "" former and current staff members , and investigated the organization 's claim that 4 @.@ 5 million Haitians had been helped "" back on their feet "" despite Joel Boutroue , a Haitian government advisor , stating that this number would cover "" 100 percent of the urban area "" , and observing that this would mean","The investigation reviewed "" hundreds "" of pages of internal documents and interviewed "" more than a dozen "" former and current staff members , and investigated the organization 's claim that 4 @.@ 5 million Haitians had been helped "" back on their feet "" despite Joel Boutroue , a Haitian government advisor , stating that this number would cover "" 100 percent of the urban area "" , and observing that this would mean they had served every city",39.57033443,5.002783775
"Numerous other claims did not hold up under investigation , and it was found that the project was riddled with "" multiple staffing changes "" , bureaucratic delays and a language barrier as many of the Red Cross officials did not speak French or Creole.","Numerous other claims did not hold up under investigation , and it was found the project was riddled with "" multiple staffing changes "" , bureaucratic delays and a language barrier as many of the Red Cross officials did not speak French or Creole.",0,find,found,that,"Numerous other claims did not hold up under investigation , and it was","Numerous other claims did not hold up under investigation , and it was found","Numerous other claims did not hold up under investigation , and it was found the project was riddled with",25.14184366,6.293849707
"The public affairs office of the Red Cross disputed NPR and ProPublica 's claims in an email , and claimed that the investigative report could cause an international incident.","The public affairs office of the Red Cross disputed NPR and ProPublica 's claims in an email , and claimed the investigative report could cause an international incident.",0,claim,claimed,that,"The public affairs office of the Red Cross disputed NPR and ProPublica 's claims in an email , and","The public affairs office of the Red Cross disputed NPR and ProPublica 's claims in an email , and claimed","The public affairs office of the Red Cross disputed NPR and ProPublica 's claims in an email , and claimed the investigative report could cause",31.32982302,6.593078375
The play was a very controversial call late in the 10 – 7 game and Ohio State coach Woody Hayes stormed the field to rant at the referee Jerry Markbreit about the referee 's call that Hayes thought should have been ruled pass interference.,The play was a very controversial call late in the 10 – 7 game and Ohio State coach Woody Hayes stormed the field to rant at the referee Jerry Markbreit about the referee 's call that Hayes thought should have been ruled pass interference.,0,think,thought,none,The play was a very controversial call late in the 10 – 7 game and Ohio State coach Woody Hayes stormed the field to rant at the referee Jerry Markbreit about the referee 's call that Hayes,The play was a very controversial call late in the 10 – 7 game and Ohio State coach Woody Hayes stormed the field to rant at the referee Jerry Markbreit about the referee 's call that Hayes thought,The play was a very controversial call late in the 10 – 7 game and Ohio State coach Woody Hayes stormed the field to rant at the referee Jerry Markbreit about the referee 's call that Hayes thought should have been ruled pass,24.25957116,7.460266113
"In the same interview , Alexis Lang , the Lead Game Designer at Kheops , commented that : "" [ A ] low score does not mean that you are stupid in any way , it just means that some pompous and bombastic lunar people think that your character is dumb ! "" This reflects the fact that the "" Intelligence Management System "" is designed primarily to earn the respect of the Selenites.","In the same interview , Alexis Lang , the Lead Game Designer at Kheops , commented : "" [ A ] low score does not mean that you are stupid in any way , it just means that some pompous and bombastic lunar people think that your character is dumb ! "" This reflects the fact that the "" Intelligence Management System "" is designed primarily to earn the respect of the Selenites.",0,comment,commented,that,"In the same interview , Alexis Lang , the Lead Game Designer at Kheops ,","In the same interview , Alexis Lang , the Lead Game Designer at Kheops , commented","In the same interview , Alexis Lang , the Lead Game Designer at Kheops , commented : "" [ A ]",26.11070836,6.949293613
"In the same interview , Alexis Lang , the Lead Game Designer at Kheops , commented that : "" [ A ] low score does not mean that you are stupid in any way , it just means that some pompous and bombastic lunar people think that your character is dumb ! "" This reflects the fact that the "" Intelligence Management System "" is designed primarily to earn the respect of the Selenites.","In the same interview , Alexis Lang , the Lead Game Designer at Kheops , commented that : "" [ A ] low score does not mean you are stupid in any way , it just means that some pompous and bombastic lunar people think that your character is dumb ! "" This reflects the fact that the "" Intelligence Management System "" is designed primarily to earn the respect of the Selenites.",0,mean,mean,that,"In the same interview , Alexis Lang , the Lead Game Designer at Kheops , commented that : "" [ A ] low score does not","In the same interview , Alexis Lang , the Lead Game Designer at Kheops , commented that : "" [ A ] low score does not mean","In the same interview , Alexis Lang , the Lead Game Designer at Kheops , commented that : "" [ A ] low score does not mean you are stupid in any",23.46236295,1.247913599
"In the same interview , Alexis Lang , the Lead Game Designer at Kheops , commented that : "" [ A ] low score does not mean that you are stupid in any way , it just means that some pompous and bombastic lunar people think that your character is dumb ! "" This reflects the fact that the "" Intelligence Management System "" is designed primarily to earn the respect of the Selenites.","In the same interview , Alexis Lang , the Lead Game Designer at Kheops , commented that : "" [ A ] low score does not mean that you are stupid in any way , it just means some pompous and bombastic lunar people think that your character is dumb ! "" This reflects the fact that the "" Intelligence Management System "" is designed primarily to earn the respect of the Selenites.",0,mean,means,that,"In the same interview , Alexis Lang , the Lead Game Designer at Kheops , commented that : "" [ A ] low score does not mean that you are stupid in any way , it just","In the same interview , Alexis Lang , the Lead Game Designer at Kheops , commented that : "" [ A ] low score does not mean that you are stupid in any way , it just means","In the same interview , Alexis Lang , the Lead Game Designer at Kheops , commented that : "" [ A ] low score does not mean that you are stupid in any way , it just means some pompous and bombastic lunar",74.04223243,0.268105328
"In the same interview , Alexis Lang , the Lead Game Designer at Kheops , commented that : "" [ A ] low score does not mean that you are stupid in any way , it just means that some pompous and bombastic lunar people think that your character is dumb ! "" This reflects the fact that the "" Intelligence Management System "" is designed primarily to earn the respect of the Selenites.","In the same interview , Alexis Lang , the Lead Game Designer at Kheops , commented that : "" [ A ] low score does not mean that you are stupid in any way , it just means that some pompous and bombastic lunar people think your character is dumb ! "" This reflects the fact that the "" Intelligence Management System "" is designed primarily to earn the respect of the Selenites.",0,think,think,that,"In the same interview , Alexis Lang , the Lead Game Designer at Kheops , commented that : "" [ A ] low score does not mean that you are stupid in any way , it just means that some pompous and bombastic lunar people","In the same interview , Alexis Lang , the Lead Game Designer at Kheops , commented that : "" [ A ] low score does not mean that you are stupid in any way , it just means that some pompous and bombastic lunar people think","In the same interview , Alexis Lang , the Lead Game Designer at Kheops , commented that : "" [ A ] low score does not mean that you are stupid in any way , it just means that some pompous and bombastic lunar people think your character is dumb !",30.27761322,5.756001472
"However , Hozjan also said that he hopes "" players will try to increase their score and certainly share their experience through forums.","However , Hozjan also said he hopes "" players will try to increase their score and certainly share their experience through forums.",0,say,said,that,"However , Hozjan also","However , Hozjan also said","However , Hozjan also said he hopes "" players will",36.49839783,3.998278856
"However , Hozjan also said that he hopes "" players will try to increase their score and certainly share their experience through forums.","However , Hozjan also said that he hopes "" players will try to increase their score and certainly share their experience through forums.",0,hope,hopes,none,"However , Hozjan also said that he","However , Hozjan also said that he hopes","However , Hozjan also said that he hopes "" players will try to",33.4364903,7.557522297
"Benoît Hozjan explained the change , saying that Journey to the Center of the Moon "" seems to be confusing and some people thought that it could be the sequel to Journey to the Center of the Earth , "" another Verne @-@ inspired PC game , "" so marketing decided to change it.","Benoît Hozjan explained the change , saying Journey to the Center of the Moon "" seems to be confusing and some people thought that it could be the sequel to Journey to the Center of the Earth , "" another Verne @-@ inspired PC game , "" so marketing decided to change it.",0,say,saying,that,"Benoît Hozjan explained the change ,","Benoît Hozjan explained the change , saying","Benoît Hozjan explained the change , saying Journey to the Center of",32.08156407,3.460519075
"Benoît Hozjan explained the change , saying that Journey to the Center of the Moon "" seems to be confusing and some people thought that it could be the sequel to Journey to the Center of the Earth , "" another Verne @-@ inspired PC game , "" so marketing decided to change it.","Benoît Hozjan explained the change , saying that Journey to the Center of the Moon "" seems to be confusing and some people thought it could be the sequel to Journey to the Center of the Earth , "" another Verne @-@ inspired PC game , "" so marketing decided to change it.",0,think,thought,that,"Benoît Hozjan explained the change , saying that Journey to the Center of the Moon "" seems to be confusing and some people","Benoît Hozjan explained the change , saying that Journey to the Center of the Moon "" seems to be confusing and some people thought","Benoît Hozjan explained the change , saying that Journey to the Center of the Moon "" seems to be confusing and some people thought it could be the sequel",21.71299699,7.692504406
"Benoît Hozjan explained Kheops Studio 's choice of Jules Verne 's work as a basis for Voyage , saying that : "" Jules Verne 's novels provide the two core elements of adventure games : dreams and challenges.","Benoît Hozjan explained Kheops Studio 's choice of Jules Verne 's work as a basis for Voyage , saying : "" Jules Verne 's novels provide the two core elements of adventure games : dreams and challenges.",0,say,saying,that,"Benoît Hozjan explained Kheops Studio 's choice of Jules Verne 's work as a basis for Voyage ,","Benoît Hozjan explained Kheops Studio 's choice of Jules Verne 's work as a basis for Voyage , saying","Benoît Hozjan explained Kheops Studio 's choice of Jules Verne 's work as a basis for Voyage , saying : "" Jules Verne 's",20.70754758,4.791811943
""" He further went on to say that the game is influenced by Verne 's From the Earth to the Moon , which documents the lead up to the lunar trip , but draws more heavily from the sequel Around the Moon , which recounts the actual voyage.",""" He further went on to say the game is influenced by Verne 's From the Earth to the Moon , which documents the lead up to the lunar trip , but draws more heavily from the sequel Around the Moon , which recounts the actual voyage.",0,say,say,that,""" He further went on to",""" He further went on to say",""" He further went on to say the game is influenced by",31.3896547,1.366499782
"Additionally , Alexis Lang attributed the inspiration for the Selenites to H.G. Wells ' The First Men in the Moon , explaining that : "" [ Wells ] pictured a very ancient Selenite civilisation horrified at human roughness.","Additionally , Alexis Lang attributed the inspiration for the Selenites to H.G. Wells ' The First Men in the Moon , explaining : "" [ Wells ] pictured a very ancient Selenite civilisation horrified at human roughness.",0,explain,explaining,that,"Additionally , Alexis Lang attributed the inspiration for the Selenites to H.G. Wells ' The First Men in the Moon ,","Additionally , Alexis Lang attributed the inspiration for the Selenites to H.G. Wells ' The First Men in the Moon , explaining","Additionally , Alexis Lang attributed the inspiration for the Selenites to H.G. Wells ' The First Men in the Moon , explaining : "" [ Wells ]",25.72091639,11.74929738
"One of the more positively received aspects of the game was its ability to recreate the mood of 19th century science @-@ fiction , with GameSpot writing that the game "" nicely re @-@ creates the whimsical mood of 19th @-@ century sci @-@ fi [ and ] a sense of wonder fills every pixel of the graphic design.","One of the more positively received aspects of the game was its ability to recreate the mood of 19th century science @-@ fiction , with GameSpot writing the game "" nicely re @-@ creates the whimsical mood of 19th @-@ century sci @-@ fi [ and ] a sense of wonder fills every pixel of the graphic design.",0,write,writing,that,"One of the more positively received aspects of the game was its ability to recreate the mood of 19th century science @-@ fiction , with GameSpot","One of the more positively received aspects of the game was its ability to recreate the mood of 19th century science @-@ fiction , with GameSpot writing","One of the more positively received aspects of the game was its ability to recreate the mood of 19th century science @-@ fiction , with GameSpot writing the game "" nicely re",42.51437545,6.733491898
""" In contrast , Game Over Online Magazine said that once the player leaves the capsule and arrives on the moon , instead of viewing colorful and wondrous sights , the game turns into a drab and unlikely bore.",""" In contrast , Game Over Online Magazine said once the player leaves the capsule and arrives on the moon , instead of viewing colorful and wondrous sights , the game turns into a drab and unlikely bore.",0,say,said,that,""" In contrast , Game Over Online Magazine",""" In contrast , Game Over Online Magazine said",""" In contrast , Game Over Online Magazine said once the player leaves the",31.44007605,6.82368803
Artist and designer Keiji Inafune claimed Mega Man & Bass was created with regard to younger players who did not yet own one of the more advanced gaming systems.,Artist and designer Keiji Inafune claimed Mega Man & Bass was created with regard to younger players who did not yet own one of the more advanced gaming systems.,0,claim,claimed,none,Artist and designer Keiji Inafune,Artist and designer Keiji Inafune claimed,Artist and designer Keiji Inafune claimed Mega Man & Bass was,42.85309845,13.36194183
"The pair explains that humans are the ones who created robots in the first place , which confuses King.","The pair explains humans are the ones who created robots in the first place , which confuses King.",0,explain,explains,that,The pair,The pair explains,The pair explains humans are the ones who,33.32387459,14.223629
"The villain reveals that his creator is Dr. Wily , who then appears on a video monitor.","The villain reveals his creator is Dr. Wily , who then appears on a video monitor.",0,reveal,reveals,that,The villain,The villain reveals,The villain reveals his creator is Dr. Wily,39.82350045,12.38094711
"When Wily is beaten , Bass demands to know why he deceived him.","When Wily is beaten , Bass demands to know why he deceived him.",0,know,know,other,"When Wily is beaten , Bass demands to","When Wily is beaten , Bass demands to know","When Wily is beaten , Bass demands to know why he deceived him.",21.25204131,0.310423702
Wily explains that he created King simply to test Bass ' abilities.,Wily explains he created King simply to test Bass ' abilities.,0,explain,explains,that,Wily,Wily explains,Wily explains he created King simply to,45.7667377,15.26784515
"Wily shows him written plans for making a newer version of King to join with Bass in this venture , promising that the two would be invincible together.","Wily shows him written plans for making a newer version of King to join with Bass in this venture , promising the two would be invincible together.",0,promise,promising,that,"Wily shows him written plans for making a newer version of King to join with Bass in this venture ,","Wily shows him written plans for making a newer version of King to join with Bass in this venture , promising","Wily shows him written plans for making a newer version of King to join with Bass in this venture , promising the two would be invincible",33.21472549,11.75746441
"It was then Proto Man tells Bass that although he is a strong robot of free will , he can never defeat his rival because he has nothing for which to fight.","It was then Proto Man tells Bass although he is a strong robot of free will , he can never defeat his rival because he has nothing for which to fight.",1,tell,tells,that,It was then Proto Man,It was then Proto Man tells,It was then Proto Man tells Bass although he is a strong,48.92932045,11.15177917
"Bass doesn 't care and forces Proto Man to leave , saying that he will still destroy Mega Man to prove his cause.","Bass doesn 't care and forces Proto Man to leave , saying he will still destroy Mega Man to prove his cause.",0,say,saying,that,"Bass doesn 't care and forces Proto Man to leave ,","Bass doesn 't care and forces Proto Man to leave , saying","Bass doesn 't care and forces Proto Man to leave , saying he will still destroy Mega",33.09249389,6.625495434
King wishes to atone for his own crimes against humans and hopes for them to be friends if they were to meet in the future.,King wishes to atone for his own crimes against humans and hopes for them to be friends if they were to meet in the future.,0,hope,hopes,none,King wishes to atone for his own crimes against humans and,King wishes to atone for his own crimes against humans and hopes,King wishes to atone for his own crimes against humans and hopes for them to be friends,30.62676567,9.888130188
"Both Giancarlo Varanini of GameSpot and Craig Harris of IGN found that the game 's bosses have very unpredictable attack patterns , thus making the battles extremely challenging.","Both Giancarlo Varanini of GameSpot and Craig Harris of IGN found the game 's bosses have very unpredictable attack patterns , thus making the battles extremely challenging.",0,find,found,that,Both Giancarlo Varanini of GameSpot and Craig Harris of IGN,Both Giancarlo Varanini of GameSpot and Craig Harris of IGN found,Both Giancarlo Varanini of GameSpot and Craig Harris of IGN found the game 's bosses have,39.5249207,9.794541359
"Inafune explained in an interview with the Brazilian magazine Nintendo World that the ninth installment follows the storyline of Mega Man 8 and that the worlds for Mega Man & Bass and Mega Man 9 are meant to coincide with one another , as evidenced by a schematic of Bass in the ending of the game.","Inafune explained in an interview with the Brazilian magazine Nintendo World the ninth installment follows the storyline of Mega Man 8 and that the worlds for Mega Man & Bass and Mega Man 9 are meant to coincide with one another , as evidenced by a schematic of Bass in the ending of the game.",9,explain,explained,that,Inafune,Inafune explained,Inafune explained in an interview with the Brazilian magazine Nintendo World the ninth installment follows the,92.61695799,11.24190807
"In 2010 , ODOT determined that an average of 710 vehicles per day traveled along the length of SR 319.","In 2010 , ODOT determined an average of 710 vehicles per day traveled along the length of SR 319.",0,determine,determined,that,"In 2010 , ODOT","In 2010 , ODOT determined","In 2010 , ODOT determined an average of 710 vehicles",36.95623595,7.351739883
"This led to the 26 June 1907 resolution in the House of Commons declaring that the Lords ' power should be curtailed , put forward by Liberal Prime Minister Henry Campbell @-@ Bannerman.","This led to the 26 June 1907 resolution in the House of Commons declaring the Lords ' power should be curtailed , put forward by Liberal Prime Minister Henry Campbell @-@ Bannerman.",0,declare,declaring,that,This led to the 26 June 1907 resolution in the House of Commons,This led to the 26 June 1907 resolution in the House of Commons declaring,This led to the 26 June 1907 resolution in the House of Commons declaring the Lords ' power should,53.03489113,6.364860058
The Lords suggested that the Commons justify its position as representing the will of the people : it did this through the January 1910 general election.,The Lords suggested the Commons justify its position as representing the will of the people : it did this through the January 1910 general election.,0,suggest,suggested,that,The Lords,The Lords suggested,The Lords suggested the Commons justify its position,38.47545576,12.24893475
"The Speaker of the House of Commons would have to certify that a bill was a money bill , endorsing it with a Speaker 's certificate.","The Speaker of the House of Commons would have to certify a bill was a money bill , endorsing it with a Speaker 's certificate.",0,certify,certify,that,The Speaker of the House of Commons would have to,The Speaker of the House of Commons would have to certify,The Speaker of the House of Commons would have to certify a bill was a money,36.81650257,10.02680302
"This two @-@ year period meant that legislation introduced in the fourth or fifth years of a parliament could be delayed until after the next election , which could prove an effective measure to prevent it being passed.","This two @-@ year period meant legislation introduced in the fourth or fifth years of a parliament could be delayed until after the next election , which could prove an effective measure to prevent it being passed.",0,mean,meant,that,This two @-@ year period,This two @-@ year period meant,This two @-@ year period meant legislation introduced in the fourth,41.6369065,13.42644024
The Speaker has to also certify that the conditions of the bill had been complied with.,The Speaker has to also certify the conditions of the bill had been complied with.,0,certify,certify,that,The Speaker has to also,The Speaker has to also certify,The Speaker has to also certify the conditions of the bill,21.29717207,9.972362518
"This ruling also means that efforts to abolish the House of Lords ( a major constitutional change ) using the Act could be successful , although the issue was not directly addressed in the ruling.","This ruling also means efforts to abolish the House of Lords ( a major constitutional change ) using the Act could be successful , although the issue was not directly addressed in the ruling.",0,mean,means,that,This ruling also,This ruling also means,This ruling also means efforts to abolish the House,37.56035268,5.000540733
