sentence,pseudo_that,context,embedded_clause,matrix_verb_to_cc,verb,verb_in_text,embedded_clause_n,comp_type,context_verb,context_verb_n,embedded_n_sum,verb_sum
"Niagara @-@ based cookbook author and food e @-@ magazine publisher Lynn Ogryzlo visited the chip trucks in August 2012 and stated "" I was blown away by Sarnia , "" not only by the city 's waterfront , where the chip trucks are located , but also by the chip trucks themselves.","Niagara @-@ based cookbook author and food e @-@ magazine publisher Lynn Ogryzlo visited the chip trucks in August 2012 and stated "" I was blown away by Sarnia , "" not only by the city 's waterfront , where the chip trucks are located , but also by the chip trucks themselves.",Niagara @-@ based cookbook author and food e @-@ magazine publisher Lynn Ogryzlo visited the chip trucks in August 2012 and,""" I was blown away by Sarnia , "" not only by the city 's waterfront , where the chip trucks are located , but also by the chip trucks themselves.",0,state,stated,"Niagara @-@ based cookbook author and food e @ - @ magazine publisher Lynn Ogryzlo visited the chip trucks in August 2012 and stated "" I was blown away",none,Niagara @-@ based cookbook author and food e @-@ magazine publisher Lynn Ogryzlo visited the chip trucks in August 2012 and stated,"Niagara @-@ based cookbook author and food e @-@ magazine publisher Lynn Ogryzlo visited the chip trucks in August 2012 and stated "" I was blown away by Sarnia",46.105308897211216,10.537537574768066
"An official statement from DePaul strongly defended the decision to deny Finkelstein tenure , stated that outside influence played no role in the decision.","An official statement from DePaul strongly defended the decision to deny Finkelstein tenure , stated outside influence played no role in the decision.","An official statement from DePaul strongly defended the decision to deny Finkelstein tenure ,",outside influence played no role in the decision.,0,state,stated,"An official statement from DePaul strongly defended the decision to deny Finkelstein tenure , stated outside influence played no role",that,"An official statement from DePaul strongly defended the decision to deny Finkelstein tenure , stated","An official statement from DePaul strongly defended the decision to deny Finkelstein tenure , stated outside influence played no role in the",47.24389827251434,14.732865333557129
"She considered the day of her liberation as the most horrible day of her life , as she realized that she was alone , her parents and siblings gone.","She considered the day of her liberation as the most horrible day of her life , as she realized she was alone , her parents and siblings gone.","She considered the day of her liberation as the most horrible day of her life , as she","she was alone , her parents and siblings gone.",0,realize,realized,"She considered the day of her liberation as the most horrible day of her life , as she realized she was alone , her",that,"She considered the day of her liberation as the most horrible day of her life , as she realized","She considered the day of her liberation as the most horrible day of her life , as she realized she was alone , her parents and",32.823185324668884,7.381071090698242
"Of his parents , Finkelstein has recalled that "" they saw the world through the prism of the Nazi Holocaust.","Of his parents , Finkelstein has recalled "" they saw the world through the prism of the Nazi Holocaust.","Of his parents , Finkelstein has",""" they saw the world through the prism of the Nazi Holocaust.",0,recall,recalled,"Of his parents , Finkelstein has recalled "" they saw the world",that,"Of his parents , Finkelstein has recalled","Of his parents , Finkelstein has recalled "" they saw the world through the",42.66608810424805,10.971117973327637
"They supported the Soviet Union 's approval of the creation of the State of Israel , as enunciated by Gromyko , who stated that the Jews had earned the right to a state , but thought that Israel had sold its soul to the West and "" refused to have any truck with it "".","They supported the Soviet Union 's approval of the creation of the State of Israel , as enunciated by Gromyko , who stated the Jews had earned the right to a state , but thought that Israel had sold its soul to the West and "" refused to have any truck with it "".","They supported the Soviet Union 's approval of the creation of the State of Israel , as enunciated by Gromyko , who","the Jews had earned the right to a state , but thought that Israel had sold its soul to the West and "" refused to have any truck with it "".",0,state,stated,"They supported the Soviet Union 's approval of the creation of the State of Israel , as enunciated by Gromyko , who stated the Jews had earned the",that,"They supported the Soviet Union 's approval of the creation of the State of Israel , as enunciated by Gromyko , who stated","They supported the Soviet Union 's approval of the creation of the State of Israel , as enunciated by Gromyko , who stated the Jews had earned the right to",30.123522717505693,5.87028169631958
"They supported the Soviet Union 's approval of the creation of the State of Israel , as enunciated by Gromyko , who stated that the Jews had earned the right to a state , but thought that Israel had sold its soul to the West and "" refused to have any truck with it "".","They supported the Soviet Union 's approval of the creation of the State of Israel , as enunciated by Gromyko , who stated that the Jews had earned the right to a state , but thought Israel had sold its soul to the West and "" refused to have any truck with it "".","They supported the Soviet Union 's approval of the creation of the State of Israel , as enunciated by Gromyko , who stated that the Jews had earned the right to a state , but","Israel had sold its soul to the West and "" refused to have any truck with it "".",0,think,thought,"They supported the Soviet Union 's approval of the creation of the State of Israel , as enunciated by Gromyko , who stated that the Jews had earned the right to a state , but thought Israel had sold its soul",that,"They supported the Soviet Union 's approval of the creation of the State of Israel , as enunciated by Gromyko , who stated that the Jews had earned the right to a state , but thought","They supported the Soviet Union 's approval of the creation of the State of Israel , as enunciated by Gromyko , who stated that the Jews had earned the right to a state , but thought Israel had sold its soul to the",31.26322866976261,11.547568321228027
"Citing linguist and political activist Noam Chomsky as an example , Finkelstein notes that it is "" possible to unite exacting scholarly rigor with scathing moral outrage , "" and supporters and detractors alike have remarked on the polemical style of Finkelstein 's work.","Citing linguist and political activist Noam Chomsky as an example , Finkelstein notes it is "" possible to unite exacting scholarly rigor with scathing moral outrage , "" and supporters and detractors alike have remarked on the polemical style of Finkelstein 's work.","Citing linguist and political activist Noam Chomsky as an example , Finkelstein","it is "" possible to unite exacting scholarly rigor with scathing moral outrage , "" and supporters and detractors alike have remarked on the polemical style of Finkelstein 's work.",0,note,notes,"Citing linguist and political activist Noam Chomsky as an example , Finkelstein notes it is "" possible to",that,"Citing linguist and political activist Noam Chomsky as an example , Finkelstein notes","Citing linguist and political activist Noam Chomsky as an example , Finkelstein notes it is "" possible to unite exacting",62.030028343200684,5.8542304039001465
"Demographic studies had tended to assert that the Arab population of Ottoman @-@ controlled Palestine , a 94 % majority at the turn of the century , had dwindled towards parity due to massive Zionist immigration.","Demographic studies had tended to assert the Arab population of Ottoman @-@ controlled Palestine , a 94 % majority at the turn of the century , had dwindled towards parity due to massive Zionist immigration.",Demographic studies had tended to,"the Arab population of Ottoman @-@ controlled Palestine , a 94 % majority at the turn of the century , had dwindled towards parity due to massive Zionist immigration.",0,assert,assert,Demographic studies had tended to assert the Arab population of Ottoman,that,Demographic studies had tended to assert,Demographic studies had tended to assert the Arab population of Ottoman @-@ controlled,88.01659190282226,11.876479148864746
Peters radically challenged this picture by arguing that a substantial part of the Palestinian people were descended from immigrants from other Arab countries from the early 19th century onwards.,Peters radically challenged this picture by arguing a substantial part of the Palestinian people were descended from immigrants from other Arab countries from the early 19th century onwards.,Peters radically challenged this picture by,a substantial part of the Palestinian people were descended from immigrants from other Arab countries from the early 19th century onwards.,0,argue,arguing,Peters radically challenged this picture by arguing a substantial part of the,that,Peters radically challenged this picture by arguing,Peters radically challenged this picture by arguing a substantial part of the Palestinian people,41.551385812461376,5.4027180671691895
"Finkelstein asserted that the book was a "" monumental hoax "".","Finkelstein asserted the book was a "" monumental hoax "".",Finkelstein,"the book was a "" monumental hoax "".",0,assert,asserted,"Finkelstein asserted the book was a """,that,Finkelstein asserted,"Finkelstein asserted the book was a "" monumental hoax",52.05683159828186,14.605268478393555
"He later opined that , while Peters 's book received widespread interest and approval in the United States , a scholarly demonstration of its fraudulence and unreliability aroused little attention :.","He later opined , while Peters 's book received widespread interest and approval in the United States , a scholarly demonstration of its fraudulence and unreliability aroused little attention :.",He later,", while Peters 's book received widespread interest and approval in the United States , a scholarly demonstration of its fraudulence and unreliability aroused little attention :.",0,opine,opined,"He later opined , while Peters 's book",that,He later opined,"He later opined , while Peters 's book received widespread",66.82170045375824,14.281868522055447
"Not a single national newspaper or columnist contacted found newsworthy that a best @-@ selling , effusively praised ' study ' of the Middle East conflict was a threadbare hoax.","Not a single national newspaper or columnist contacted found newsworthy a best @-@ selling , effusively praised ' study ' of the Middle East conflict was a threadbare hoax.",Not a single national newspaper or columnist contacted,"a best @-@ selling , effusively praised ' study ' of the Middle East conflict was a threadbare hoax.",1,find,found,"Not a single national newspaper or columnist contacted found newsworthy a best @-@ selling ,",that,Not a single national newspaper or columnist contacted found,"Not a single national newspaper or columnist contacted found newsworthy a best @-@ selling , effusively praised",137.97969534993172,17.72891616821289
""" I warned him , if you follow this , you 're going to get in trouble — because you 're going to expose the American intellectual community as a gang of frauds , and they are not going to like it , and they 're going to destroy you.",""" I warned him , if you follow this , you 're going to get in trouble — because you 're going to expose the American intellectual community as a gang of frauds , and they are not going to like it , and they 're going to destroy you.",""" I","him , if you follow this , you 're going to get in trouble — because you 're going to expose the American intellectual community as a gang of frauds , and they are not going to like it , and they 're going to destroy you.",0,warn,warned,""" I warned him , if you follow",none,""" I warned",""" I warned him , if you follow this ,",35.91931235790253,13.272849082946777
"Israeli historian Avi Shlaim later praised Finkelstein 's thesis , saying that it had established his credentials when he was still a doctoral student.","Israeli historian Avi Shlaim later praised Finkelstein 's thesis , saying it had established his credentials when he was still a doctoral student.","Israeli historian Avi Shlaim later praised Finkelstein 's thesis ,",it had established his credentials when he was still a doctoral student.,0,say,saying,"Israeli historian Avi Shlaim later praised Finkelstein 's thesis , saying it had established his credentials",that,"Israeli historian Avi Shlaim later praised Finkelstein 's thesis , saying","Israeli historian Avi Shlaim later praised Finkelstein 's thesis , saying it had established his credentials when he",41.389562487602234,3.1952719688415527
"In Shlaim 's view , Finkelstein had produced an "" unanswerable case "" with "" irrefutable evidence "" , proving that Peters ' book was both "" preposterous and worthless "".","In Shlaim 's view , Finkelstein had produced an "" unanswerable case "" with "" irrefutable evidence "" , proving Peters ' book was both "" preposterous and worthless "".","In Shlaim 's view , Finkelstein had produced an "" unanswerable case "" with "" irrefutable evidence "" ,","Peters ' book was both "" preposterous and worthless "".",0,prove,proving,"In Shlaim 's view , Finkelstein had produced an "" unanswerable case "" with "" irrefutable evidence "" , proving Peters ' book was both",that,"In Shlaim 's view , Finkelstein had produced an "" unanswerable case "" with "" irrefutable evidence "" , proving","In Shlaim 's view , Finkelstein had produced an "" unanswerable case "" with "" irrefutable evidence "" , proving Peters ' book was both "" preposterous",61.476617738604546,8.6953125
"Chomsky wrote in Understanding Power that Finkelstein "" literally could not get the faculty to read [ his dissertation ] "" and that Princeton eventually granted Finkelstein his doctorate only "" out of embarrassment [ for Princeton ] "" but refused to give him any further professional backing.","Chomsky wrote in Understanding Power Finkelstein "" literally could not get the faculty to read [ his dissertation ] "" and that Princeton eventually granted Finkelstein his doctorate only "" out of embarrassment [ for Princeton ] "" but refused to give him any further professional backing.",Chomsky,"Finkelstein "" literally could not get the faculty to read [ his dissertation ] "" and that Princeton eventually granted Finkelstein his doctorate only "" out of embarrassment [ for Princeton ] "" but refused to give him any further professional backing.",3,write,wrote,"Chomsky wrote in Understanding Power Finkelstein "" literally could not",that,Chomsky wrote,"Chomsky wrote in Understanding Power Finkelstein "" literally could not get the",98.59194764494896,7.692012310028076
"Here , Finkelstein argues that Elie Wiesel and others exploit the memory of the Holocaust as an "" ideological weapon.","Here , Finkelstein argues Elie Wiesel and others exploit the memory of the Holocaust as an "" ideological weapon.","Here , Finkelstein","Elie Wiesel and others exploit the memory of the Holocaust as an "" ideological weapon.",0,argue,argues,"Here , Finkelstein argues Elie Wiesel and others exploit",that,"Here , Finkelstein argues","Here , Finkelstein argues Elie Wiesel and others exploit the memory",57.58945344015956,7.755722999572754
"Israeli Holocaust historian Israel Gutman called the book "" a lampoon "" , stating "" this is not research ; it isn 't even political literature ... I don 't even think it should be reviewed or critiqued as a legitimate book.","Israeli Holocaust historian Israel Gutman called the book "" a lampoon "" , stating "" this is not research ; it isn 't even political literature ... I don 't even think it should be reviewed or critiqued as a legitimate book.","Israeli Holocaust historian Israel Gutman called the book "" a lampoon "" ,",""" this is not research ; it isn 't even political literature ... I don 't even think it should be reviewed or critiqued as a legitimate book.",0,state,stating,"Israeli Holocaust historian Israel Gutman called the book "" a lampoon "" , stating "" this is not research",none,"Israeli Holocaust historian Israel Gutman called the book "" a lampoon "" , stating","Israeli Holocaust historian Israel Gutman called the book "" a lampoon "" , stating "" this is not research ; it",39.52368474006653,7.847315788269043
"Israeli Holocaust historian Israel Gutman called the book "" a lampoon "" , stating "" this is not research ; it isn 't even political literature ... I don 't even think it should be reviewed or critiqued as a legitimate book.","Israeli Holocaust historian Israel Gutman called the book "" a lampoon "" , stating "" this is not research ; it isn 't even political literature ... I don 't even think it should be reviewed or critiqued as a legitimate book.","Israeli Holocaust historian Israel Gutman called the book "" a lampoon "" , stating "" this is not research ; it isn 't even political literature ... I don 't even",it should be reviewed or critiqued as a legitimate book.,0,think,think,"Israeli Holocaust historian Israel Gutman called the book "" a lampoon "" , stating "" this is not research ; it isn 't even political literature ... I don 't even think it should be reviewed or",none,"Israeli Holocaust historian Israel Gutman called the book "" a lampoon "" , stating "" this is not research ; it isn 't even political literature ... I don 't even think","Israeli Holocaust historian Israel Gutman called the book "" a lampoon "" , stating "" this is not research ; it isn 't even political literature ... I don 't even think it should be reviewed or critiqued as",34.578757860464975,3.9112660884857178
"However , preeminent Holocaust scholar Raul Hilberg said the book expressed views Hilberg himself subscribed to in substance , in that he too found the exploitation of the Holocaust , as Finkelstein describes , "" detestable "".","However , preeminent Holocaust scholar Raul Hilberg said the book expressed views Hilberg himself subscribed to in substance , in that he too found the exploitation of the Holocaust , as Finkelstein describes , "" detestable "".","However , preeminent Holocaust scholar Raul Hilberg","the book expressed views Hilberg himself subscribed to in substance , in that he too found the exploitation of the Holocaust , as Finkelstein describes , "" detestable "".",0,say,said,"However , preeminent Holocaust scholar Raul Hilberg said the book expressed views Hilberg",none,"However , preeminent Holocaust scholar Raul Hilberg said","However , preeminent Holocaust scholar Raul Hilberg said the book expressed views Hilberg himself subscribed",64.19256492122076,4.930531978607178
"Asked on another occasion if Finkelstein 's analysis might play into the hands of neo @-@ Nazis for antisemitic purposes , Hilberg replied : "" Well , even if they do use it in that fashion , I 'm afraid that when it comes to the truth , it has to be said openly , without regard to any consequences that would be undesirable , embarrassing "".","Asked on another occasion if Finkelstein 's analysis might play into the hands of neo @-@ Nazis for antisemitic purposes , Hilberg replied : "" Well , even if they do use it in that fashion , I 'm afraid that when it comes to the truth , it has to be said openly , without regard to any consequences that would be undesirable , embarrassing "".","Asked on another occasion if Finkelstein 's analysis might play into the hands of neo @-@ Nazis for antisemitic purposes , Hilberg",": "" Well , even if they do use it in that fashion , I 'm afraid that when it comes to the truth , it has to be said openly , without regard to any consequences that would be undesirable , embarrassing "".",0,reply,replied,"Nazis for antisemitic purposes , Hilberg replied : "" Well , even",none,"Asked on another occasion if Finkelstein 's analysis might play into the hands of neo @-@ Nazis for antisemitic purposes , Hilberg replied","Asked on another occasion if Finkelstein 's analysis might play into the hands of neo @-@ Nazis for antisemitic purposes , Hilberg replied : "" Well , even if they",36.318738996982574,1.607474535703659
Other critics claim Finkelstein 's evidence is highly selective and / or dubious and that his arguments would be based on a misinterpretation of history and a questionable use of sources.,Other critics claim Finkelstein 's evidence is highly selective and / or dubious and that his arguments would be based on a misinterpretation of history and a questionable use of sources.,Other critics,Finkelstein 's evidence is highly selective and / or dubious and that his arguments would be based on a misinterpretation of history and a questionable use of sources.,0,claim,claim,Other critics claim Finkelstein 's evidence is highly,none,Other critics claim,Other critics claim Finkelstein 's evidence is highly selective and,56.99868419766426,6.132394313812256
"The historian David Cesarani wrote that while Finkelstein absolves Swiss banks of serious misconduct towards Holocaust survivors and depicts them as victims of a Jewish terror based on a sentence from an important report annex , he had ignored the report body which describes deceitful actions by Swiss banks , inappropriate closing of accounts , failure to keep adequate records , and so on.","The historian David Cesarani wrote while Finkelstein absolves Swiss banks of serious misconduct towards Holocaust survivors and depicts them as victims of a Jewish terror based on a sentence from an important report annex , he had ignored the report body which describes deceitful actions by Swiss banks , inappropriate closing of accounts , failure to keep adequate records , and so on.",The historian David Cesarani,"while Finkelstein absolves Swiss banks of serious misconduct towards Holocaust survivors and depicts them as victims of a Jewish terror based on a sentence from an important report annex , he had ignored the report body which describes deceitful actions by Swiss banks , inappropriate closing of accounts , failure to keep adequate records , and so on.",0,write,wrote,The historian David Cesarani wrote while Finkelstein absolves Swiss banks,that,The historian David Cesarani wrote,The historian David Cesarani wrote while Finkelstein absolves Swiss banks of serious,83.84160214662552,5.912099838256836
"During a debate on Democracy Now ! , Finkelstein asserted that Dershowitz lacked knowledge about specific contents of his own book.","During a debate on Democracy Now ! , Finkelstein asserted Dershowitz lacked knowledge about specific contents of his own book.","During a debate on Democracy Now ! , Finkelstein",Dershowitz lacked knowledge about specific contents of his own book.,0,assert,asserted,"During a debate on Democracy Now ! , Finkelstein asserted Dershowitz lacked knowledge about specific",that,"During a debate on Democracy Now ! , Finkelstein asserted","During a debate on Democracy Now ! , Finkelstein asserted Dershowitz lacked knowledge about specific contents of",68.47847672505304,7.3127827644348145
"He also claimed that Dershowitz did not write the book , and may not have even read it.","He also claimed Dershowitz did not write the book , and may not have even read it.",He also,"Dershowitz did not write the book , and may not have even read it.",0,claim,claimed,He also claimed Dershowitz did not write the,that,He also claimed,"He also claimed Dershowitz did not write the book ,",52.988647422804206,5.961358070373535
Finkelstein suggests that this copying of quotations amounts to copying ideas.,Finkelstein suggests this copying of quotations amounts to copying ideas.,Finkelstein,this copying of quotations amounts to copying ideas.,0,suggest,suggests,Finkelstein suggests this copying of quotations amounts,that,Finkelstein suggests,Finkelstein suggests this copying of quotations amounts to copying,59.25236598402262,10.08614730834961
"Dershowitz answered the charge in a letter to the University of California 's Press Director Lynne Withey , arguing that Finkelstein had made up the smoking gun quotation , in that he had changed its wording ( from ' cite ' to ' copy ' ) in his book.","Dershowitz answered the charge in a letter to the University of California 's Press Director Lynne Withey , arguing Finkelstein had made up the smoking gun quotation , in that he had changed its wording ( from ' cite ' to ' copy ' ) in his book.","Dershowitz answered the charge in a letter to the University of California 's Press Director Lynne Withey ,","Finkelstein had made up the smoking gun quotation , in that he had changed its wording ( from ' cite ' to ' copy ' ) in his book.",0,argue,arguing,"Dershowitz answered the charge in a letter to the University of California 's Press Director Lynne Withey , arguing Finkelstein had made up the",that,"Dershowitz answered the charge in a letter to the University of California 's Press Director Lynne Withey , arguing","Dershowitz answered the charge in a letter to the University of California 's Press Director Lynne Withey , arguing Finkelstein had made up the smoking gun",58.53891686350107,8.272594451904297
