sentence,pseudo_that,matrix_verb_to_cc,verb,verb_in_text,comp_type,context,context_verb,context_verb_n,embedded_n_sum,verb_sum
"The Germans also thought that some Commandos were still hiding in the town , and made a street by street search , during which some townspeople were also killed.","The Germans also thought some Commandos were still hiding in the town , and made a street by street search , during which some townspeople were also killed.",0,think,thought,that,The Germans also,The Germans also thought,The Germans also thought some Commandos were still hiding,44.89564776,8.469818115
"In October 2011 , it was announced that this would join DC titles in being published digitally on the same day as its physical release , starting in January 2012.","In October 2011 , it was announced this would join DC titles in being published digitally on the same day as its physical release , starting in January 2012.",0,announce,announced,that,"In October 2011 , it was","In October 2011 , it was announced","In October 2011 , it was announced this would join DC titles",58.19130757,1.711097002
"Although issue 14 made a passing reference to superheroes , the series since developed its own pocket universe in which the supernatural or paranormal did not play a large role in the lives of most ordinary people , and in Earth @-@ threatening circumstances no superhero interventions were shown or hinted at , suggesting that superheroes no longer existed there.","Although issue 14 made a passing reference to superheroes , the series since developed its own pocket universe in which the supernatural or paranormal did not play a large role in the lives of most ordinary people , and in Earth @-@ threatening circumstances no superhero interventions were shown or hinted at , suggesting superheroes no longer existed there.",0,suggest,suggesting,that,"Although issue 14 made a passing reference to superheroes , the series since developed its own pocket universe in which the supernatural or paranormal did not play a large role in the lives of most ordinary people , and in Earth @-@ threatening circumstances no superhero interventions were shown or hinted at ,","Although issue 14 made a passing reference to superheroes , the series since developed its own pocket universe in which the supernatural or paranormal did not play a large role in the lives of most ordinary people , and in Earth @-@ threatening circumstances no superhero interventions were shown or hinted at , suggesting","Although issue 14 made a passing reference to superheroes , the series since developed its own pocket universe in which the supernatural or paranormal did not play a large role in the lives of most ordinary people , and in Earth @-@ threatening circumstances no superhero interventions were shown or hinted at , suggesting superheroes no longer existed there.",37.33931598,8.751663506
"Delano 's run ended with "" The Golden Child "" , where John is reunited with Marj and Mercury , who help him discover that he murdered his more perfect twin in the womb , culminating in an extended story , in which we are shown what would have occurred had the other twin survived in his place.","Delano 's run ended with "" The Golden Child "" , where John is reunited with Marj and Mercury , who help him discover that he murdered his more perfect twin in the womb , culminating in an extended story , in which we are shown what would have occurred had the other twin survived in his place.",0,show,shown,other,"Delano 's run ended with "" The Golden Child "" , where John is reunited with Marj and Mercury , who help him discover that he murdered his more perfect twin in the womb , culminating in an extended story , in which we are","Delano 's run ended with "" The Golden Child "" , where John is reunited with Marj and Mercury , who help him discover that he murdered his more perfect twin in the womb , culminating in an extended story , in which we are shown","Delano 's run ended with "" The Golden Child "" , where John is reunited with Marj and Mercury , who help him discover that he murdered his more perfect twin in the womb , culminating in an extended story , in which we are shown what would have occurred had",23.24042463,3.760546684
""" Last Man Standing "" reveals that his friend Rich is the current descendant of King Arthur , and Merlin 's attempt to discover God 's secret , an act which would destroy England , using John 's few remaining friends as bait.",""" Last Man Standing "" reveals his friend Rich is the current descendant of King Arthur , and Merlin 's attempt to discover God 's secret , an act which would destroy England , using John 's few remaining friends as bait.",0,reveal,reveals,that,""" Last Man Standing """,""" Last Man Standing "" reveals",""" Last Man Standing "" reveals his friend Rich is the",38.45142758,11.55209541
"After ridding his sister 's house of an evil spirit , and finding out Gemma has gone missing , John returns to London , to find his old colleagues and enemies are all taking sides in the hunt for a mythical item , known as the Red Sepulchre.","After ridding his sister 's house of an evil spirit , and finding out Gemma has gone missing , John returns to London , to find his old colleagues and enemies are all taking sides in the hunt for a mythical item , known as the Red Sepulchre.",0,find,finding,none,"After ridding his sister 's house of an evil spirit , and","After ridding his sister 's house of an evil spirit , and finding","After ridding his sister 's house of an evil spirit , and finding out Gemma has gone missing",35.64645344,6.788271159
"After ridding his sister 's house of an evil spirit , and finding out Gemma has gone missing , John returns to London , to find his old colleagues and enemies are all taking sides in the hunt for a mythical item , known as the Red Sepulchre.","After ridding his sister 's house of an evil spirit , and finding out Gemma has gone missing , John returns to London , to find his old colleagues and enemies are all taking sides in the hunt for a mythical item , known as the Red Sepulchre.",0,find,find,none,"After ridding his sister 's house of an evil spirit , and finding out Gemma has gone missing , John returns to London , to","After ridding his sister 's house of an evil spirit , and finding out Gemma has gone missing , John returns to London , to find","After ridding his sister 's house of an evil spirit , and finding out Gemma has gone missing , John returns to London , to find his old colleagues and enemies",31.27845806,1.991402268
"John eventually gives into this offer , and the 200th issue shows how Rosacarnis manipulates his reality , making him raise three children with her , in the guise of Kit Ryan , from Garth Ennis ' time on the title , Zed , from Jamie Delano 's , and Angie , from the current run , with three different artists , Steve Dillon , Marcelo Frusin and Leonardo Manco each drawing one story , as the past , present and future of the title.","John eventually gives into this offer , and the 200th issue shows how Rosacarnis manipulates his reality , making him raise three children with her , in the guise of Kit Ryan , from Garth Ennis ' time on the title , Zed , from Jamie Delano 's , and Angie , from the current run , with three different artists , Steve Dillon , Marcelo Frusin and Leonardo Manco each drawing one story , as the past , present and future of the title.",0,show,shows,other,"John eventually gives into this offer , and the 200th issue","John eventually gives into this offer , and the 200th issue shows","John eventually gives into this offer , and the 200th issue shows how Rosacarnis manipulates his reality",78.63326483,8.979389191
"The soldiers are Scottish , so England 's loss is celebrated , saving the day , and proving there 's no source of joy like Schadenfreude.","The soldiers are Scottish , so England 's loss is celebrated , saving the day , and proving there 's no source of joy like Schadenfreude.",0,prove,proving,none,"The soldiers are Scottish , so England 's loss is celebrated , saving the day , and","The soldiers are Scottish , so England 's loss is celebrated , saving the day , and proving","The soldiers are Scottish , so England 's loss is celebrated , saving the day , and proving there 's no source of",30.80044426,11.20279884
"When he confronted her about this relationship though , she told him that she would not stop unless he was able to retrieve her mother 's soul from Hell.","When he confronted her about this relationship though , she told him she would not stop unless he was able to retrieve her mother 's soul from Hell.",1,tell,told,that,"When he confronted her about this relationship though , she","When he confronted her about this relationship though , she told","When he confronted her about this relationship though , she told him she would not stop unless",25.17300419,4.369696617
"By 2013 , Constantine was contacted by the Three Fates , who tell him that he will finally meet his end in five days.","By 2013 , Constantine was contacted by the Three Fates , who tell him he will finally meet his end in five days.",1,tell,tell,that,"By 2013 , Constantine was contacted by the Three Fates , who","By 2013 , Constantine was contacted by the Three Fates , who tell","By 2013 , Constantine was contacted by the Three Fates , who tell him he will finally meet his",23.980272,11.44862318
"John 's ghost saw them having sex in a graveyard and seemed to give his blessing , making the fates decide that John wasn 't going to try to come back to life.","John 's ghost saw them having sex in a graveyard and seemed to give his blessing , making the fates decide John wasn 't going to try to come back to life.",0,decide,decide,that,"John 's ghost saw them having sex in a graveyard and seemed to give his blessing , making the fates","John 's ghost saw them having sex in a graveyard and seemed to give his blessing , making the fates decide","John 's ghost saw them having sex in a graveyard and seemed to give his blessing , making the fates decide John wasn 't going to",38.03640975,14.83798265
"That didn 't last long , though , as John realized he can never run from his past.","That didn 't last long , though , as John realized he can never run from his past.",0,realize,realized,none,"That didn 't last long , though , as John","That didn 't last long , though , as John realized","That didn 't last long , though , as John realized he can never run from",30.90394831,14.0800333
"He stole the last dart holding the concoction that killed his demon twin , but ultimately gave it back to Gemma and told her either she could kill him , and live her life without him in but consumed with guilt for killing him , or she could let him disappear from her life forever , without any guilt for murdering him.","He stole the last dart holding the concoction that killed his demon twin , but ultimately gave it back to Gemma and told her either she could kill him , and live her life without him in but consumed with guilt for killing him , or she could let him disappear from her life forever , without any guilt for murdering him.",0,tell,told,none,"He stole the last dart holding the concoction that killed his demon twin , but ultimately gave it back to Gemma and","He stole the last dart holding the concoction that killed his demon twin , but ultimately gave it back to Gemma and told","He stole the last dart holding the concoction that killed his demon twin , but ultimately gave it back to Gemma and told her either she could kill",28.68157893,6.992845535
"On November 8 , 2012 , DC announced that Hellblazer would be cancelled following its 300th issue , and would be replaced by Constantine written by Robert Venditti and drawn by Renato Guedes starring the younger New 52 John Constantine , rather than the version from Hellblazer , depicted as being in his late 50s.","On November 8 , 2012 , DC announced Hellblazer would be cancelled following its 300th issue , and would be replaced by Constantine written by Robert Venditti and drawn by Renato Guedes starring the younger New 52 John Constantine , rather than the version from Hellblazer , depicted as being in his late 50s.",0,announce,announced,that,"On November 8 , 2012 , DC","On November 8 , 2012 , DC announced","On November 8 , 2012 , DC announced Hellblazer would be cancelled following",44.25975464,9.259872198
"Writer Ming Doyle expressed excitement in her chance to write Constantine , stating that the reason of putting the term Hellblazer back to the character 's title was to "" take Constantine back to what he was at the start.","Writer Ming Doyle expressed excitement in her chance to write Constantine , stating the reason of putting the term Hellblazer back to the character 's title was to "" take Constantine back to what he was at the start.",0,state,stating,that,"Writer Ming Doyle expressed excitement in her chance to write Constantine ,","Writer Ming Doyle expressed excitement in her chance to write Constantine , stating","Writer Ming Doyle expressed excitement in her chance to write Constantine , stating the reason of putting the",37.08445808,8.608923912
""" Robert Tutton of Paste Magazine listed the series at # 4 in its "" 13 Terrifying Modern Horror Comics "" , stating that "" Constantine ’ s most frightening encounters have hewn close enough to that kernel of truth to remind readers that real life can be as terrifying as any succubus or demon spawn.",""" Robert Tutton of Paste Magazine listed the series at # 4 in its "" 13 Terrifying Modern Horror Comics "" , stating "" Constantine ’ s most frightening encounters have hewn close enough to that kernel of truth to remind readers that real life can be as terrifying as any succubus or demon spawn.",0,state,stating,that,""" Robert Tutton of Paste Magazine listed the series at # 4 in its "" 13 Terrifying Modern Horror Comics "" ,",""" Robert Tutton of Paste Magazine listed the series at # 4 in its "" 13 Terrifying Modern Horror Comics "" , stating",""" Robert Tutton of Paste Magazine listed the series at # 4 in its "" 13 Terrifying Modern Horror Comics "" , stating "" Constantine ’ s most",65.53262925,8.07480526
"Jamie Delano 's original run on the title is looked on fondly , with journalist Helen Braithwaite stating , "" His take on the character of John Constantine has never been equalled.","Jamie Delano 's original run on the title is looked on fondly , with journalist Helen Braithwaite stating , "" His take on the character of John Constantine has never been equalled.",0,state,stating,none,"Jamie Delano 's original run on the title is looked on fondly , with journalist Helen Braithwaite","Jamie Delano 's original run on the title is looked on fondly , with journalist Helen Braithwaite stating","Jamie Delano 's original run on the title is looked on fondly , with journalist Helen Braithwaite stating , "" His take on",27.14087307,8.920704842
""" She added that , "" His writing evokes an incredible sense of dread and terror in a reader.",""" She added , "" His writing evokes an incredible sense of dread and terror in a reader.",0,add,added,that,""" She",""" She added",""" She added , "" His writing evokes",42.22907311,9.578770638
"The creator of the protagonist , Alan Moore , praised Jamie Delano 's portrayal of the character , commenting "" [ Delano ] demonstrates brilliantly that English horror didn 't vanish with the fog and gas lit cobblestones at the end of the Victorian era.","The creator of the protagonist , Alan Moore , praised Jamie Delano 's portrayal of the character , commenting "" [ Delano ] demonstrates brilliantly English horror didn 't vanish with the fog and gas lit cobblestones at the end of the Victorian era.",1,demonstrate,demonstrates,that,"The creator of the protagonist , Alan Moore , praised Jamie Delano 's portrayal of the character , commenting "" [ Delano ]","The creator of the protagonist , Alan Moore , praised Jamie Delano 's portrayal of the character , commenting "" [ Delano ] demonstrates","The creator of the protagonist , Alan Moore , praised Jamie Delano 's portrayal of the character , commenting "" [ Delano ] demonstrates brilliantly English horror didn 't vanish",76.51787257,11.4259795
""" Moore also liked Brian Azzarello 's run on the series , commenting that Azzarello and Corben captured the character "" down , cold and to the life.",""" Moore also liked Brian Azzarello 's run on the series , commenting Azzarello and Corben captured the character "" down , cold and to the life.",0,comment,commenting,that,""" Moore also liked Brian Azzarello 's run on the series ,",""" Moore also liked Brian Azzarello 's run on the series , commenting",""" Moore also liked Brian Azzarello 's run on the series , commenting Azzarello and Corben captured the",58.11081552,10.92694664
"I , Vampire writer Joshua Hale Fialkov expressed sadness he would never get to write "" the ' real ' John Constantine "" , noted crime author and former Hellblazer writer Ian Rankin stated that Constantine was the only comic book character he ever wanted to write for , and Alan Moore 's daughter , Leah Moore expressing doubt that Constantine could replace Hellblazer , among others.","I , Vampire writer Joshua Hale Fialkov expressed sadness he would never get to write "" the ' real ' John Constantine "" , noted crime author and former Hellblazer writer Ian Rankin stated Constantine was the only comic book character he ever wanted to write for , and Alan Moore 's daughter , Leah Moore expressing doubt that Constantine could replace Hellblazer , among others.",0,state,stated,that,"I , Vampire writer Joshua Hale Fialkov expressed sadness he would never get to write "" the ' real ' John Constantine "" , noted crime author and former Hellblazer writer Ian Rankin","I , Vampire writer Joshua Hale Fialkov expressed sadness he would never get to write "" the ' real ' John Constantine "" , noted crime author and former Hellblazer writer Ian Rankin stated","I , Vampire writer Joshua Hale Fialkov expressed sadness he would never get to write "" the ' real ' John Constantine "" , noted crime author and former Hellblazer writer Ian Rankin stated Constantine was the only comic",30.68488633,9.237572134
"As a result , DC co @-@ publisher Dan Didio issued a statement defending this decision , stating that , "" Hellblazer 's had a long and incredibly successful run and that 's a tip of the hat to all the great creators that have worked on the book over the years.","As a result , DC co @-@ publisher Dan Didio issued a statement defending this decision , stating , "" Hellblazer 's had a long and incredibly successful run and that 's a tip of the hat to all the great creators that have worked on the book over the years.",0,state,stating,that,"As a result , DC co @-@ publisher Dan Didio issued a statement defending this decision ,","As a result , DC co @-@ publisher Dan Didio issued a statement defending this decision , stating","As a result , DC co @-@ publisher Dan Didio issued a statement defending this decision , stating , "" Hellblazer 's had",45.82325357,3.38559103
"DC Comics announced a sequel to the 2005 Constantine movie was in the works , with producer Lorenzo di Bonaventura linked to the project.","DC Comics announced a sequel to the 2005 Constantine movie was in the works , with producer Lorenzo di Bonaventura linked to the project.",0,announce,announced,none,DC Comics,DC Comics announced,DC Comics announced a sequel to the 2005,24.21476454,5.448359191
"He stated : "" I 'd love to do it ... We want to do a hard , R @-@ rated version of it.","He stated : "" I 'd love to do it ... We want to do a hard , R @-@ rated version of it.",0,state,stated,none,He,He stated,"He stated : "" I 'd love",33.91984487,11.77030373
A few weeks later it was announced that Neil Marshall would be directing the pilot.,A few weeks later it was announced Neil Marshall would be directing the pilot.,0,announce,announced,that,A few weeks later it was,A few weeks later it was announced,A few weeks later it was announced Neil Marshall would be directing,34.70719004,1.807443857
"On February , 21 it was announced that Welsh actor Matt Ryan ( whose credits include Criminal Minds : Suspect Behavior and Edward Kenway in Assassin 's Creed IV : Black Flag ) will play the role of Constantine in the TV series pilot.","On February , 21 it was announced Welsh actor Matt Ryan ( whose credits include Criminal Minds : Suspect Behavior and Edward Kenway in Assassin 's Creed IV : Black Flag ) will play the role of Constantine in the TV series pilot.",0,announce,announced,that,"On February , 21 it was","On February , 21 it was announced","On February , 21 it was announced Welsh actor Matt Ryan (",46.6557917,1.382409334
"On May 8 , NBC announced it had officially picked up Constantine for the Fall 2014 season.","On May 8 , NBC announced it had officially picked up Constantine for the Fall 2014 season.",0,announce,announced,none,"On May 8 , NBC","On May 8 , NBC announced","On May 8 , NBC announced it had officially picked up",20.01241511,4.310270786
"Woodhouse stated that he had "" fallen out of love "" with football and decided to turn to professional boxing , despite no previous experience.","Woodhouse stated he had "" fallen out of love "" with football and decided to turn to professional boxing , despite no previous experience.",0,state,stated,that,Woodhouse,Woodhouse stated,"Woodhouse stated he had "" fallen out",36.007231,13.02037048
"Despite consistent performances , by December 2005 he had lost his place and there was speculation that he had fallen out with Taylor and wanted to leave ; this was strongly denied by the player : "" I 'm shocked that people are saying I want to go.","Despite consistent performances , by December 2005 he had lost his place and there was speculation that he had fallen out with Taylor and wanted to leave ; this was strongly denied by the player : "" I 'm shocked that people are saying I want to go.",0,say,saying,none,"Despite consistent performances , by December 2005 he had lost his place and there was speculation that he had fallen out with Taylor and wanted to leave ; this was strongly denied by the player : "" I 'm shocked that people are","Despite consistent performances , by December 2005 he had lost his place and there was speculation that he had fallen out with Taylor and wanted to leave ; this was strongly denied by the player : "" I 'm shocked that people are saying","Despite consistent performances , by December 2005 he had lost his place and there was speculation that he had fallen out with Taylor and wanted to leave ; this was strongly denied by the player : "" I 'm shocked that people are saying I want to go.",14.98189367,3.400787115
"On 26 April 2006 , Woodhouse said he planned to retire from football at the end of the 2005 – 06 season and embark on a career as a professional boxer.","On 26 April 2006 , Woodhouse said he planned to retire from football at the end of the 2005 – 06 season and embark on a career as a professional boxer.",0,say,said,none,"On 26 April 2006 , Woodhouse","On 26 April 2006 , Woodhouse said","On 26 April 2006 , Woodhouse said he planned to retire from",20.5355671,6.521699905
"Woodhouse had a history of theft , robbery and affray , and said that he had "" fallen out of love "" with football.","Woodhouse had a history of theft , robbery and affray , and said he had "" fallen out of love "" with football.",0,say,said,that,"Woodhouse had a history of theft , robbery and affray , and","Woodhouse had a history of theft , robbery and affray , and said","Woodhouse had a history of theft , robbery and affray , and said he had "" fallen out",27.99545991,9.640505746
"He said ; "" Boxing has always been my first love , even as a kid "" , and "" I love fighting ... Rather than get locked up for it , I might as well get paid for it.","He said ; "" Boxing has always been my first love , even as a kid "" , and "" I love fighting ... Rather than get locked up for it , I might as well get paid for it.",0,say,said,none,He,He said,"He said ; "" Boxing has always",43.91909504,4.460617065
""" He also stated that he used to spar in the boxing gym after football training without his manager 's knowledge , saying "" A few times at Sheffield United , Neil Warnock would drag me in and say ‘ I hear you ’ ve been boxing ’.",""" He also stated he used to spar in the boxing gym after football training without his manager 's knowledge , saying "" A few times at Sheffield United , Neil Warnock would drag me in and say ‘ I hear you ’ ve been boxing ’.",0,state,stated,that,""" He also",""" He also stated",""" He also stated he used to spar in",34.32429504,6.193140507
""" He also stated that he used to spar in the boxing gym after football training without his manager 's knowledge , saying "" A few times at Sheffield United , Neil Warnock would drag me in and say ‘ I hear you ’ ve been boxing ’.",""" He also stated that he used to spar in the boxing gym after football training without his manager 's knowledge , saying "" A few times at Sheffield United , Neil Warnock would drag me in and say ‘ I hear you ’ ve been boxing ’.",0,say,saying,none,""" He also stated that he used to spar in the boxing gym after football training without his manager 's knowledge ,",""" He also stated that he used to spar in the boxing gym after football training without his manager 's knowledge , saying",""" He also stated that he used to spar in the boxing gym after football training without his manager 's knowledge , saying "" A few times at",26.81344533,5.82722497
