sentence,pseudo_that,context,embedded_clause,matrix_verb_to_cc,verb,verb_in_text,embedded_clause_n,comp_type,context_verb,context_verb_n,embedded_n_sum,verb_sum
"In a 2014 interview , professor Matthew Abraham , author of Out of Bounds : Academic Freedom and the Question of Palestine , described the Finkelstein tenure case as "" one of the most significant academic freedom cases in the last fifty years "" , claiming the case demonstrated "" the substantial pressure outside parties can place on a mid @-@ tier religious institution when the perspectives advanced by a controversial scholar threaten dominant interests "".","In a 2014 interview , professor Matthew Abraham , author of Out of Bounds : Academic Freedom and the Question of Palestine , described the Finkelstein tenure case as "" one of the most significant academic freedom cases in the last fifty years "" , claiming the case demonstrated "" the substantial pressure outside parties can place on a mid @-@ tier religious institution when the perspectives advanced by a controversial scholar threaten dominant interests "".","In a 2014 interview , professor Matthew Abraham , author of Out of Bounds : Academic Freedom and the Question of Palestine , described the Finkelstein tenure case as "" one of the most significant academic freedom cases in the last fifty years "" ,","the case demonstrated "" the substantial pressure outside parties can place on a mid @-@ tier religious institution when the perspectives advanced by a controversial scholar threaten dominant interests "".",0,claim,claiming,"In a 2014 interview , professor Matthew Abraham , author of Out of Bounds : Academic Freedom and the Question of Palestine , described the Finkelstein tenure case as "" one of the most significant academic freedom cases in the last fifty years "" , claiming the case demonstrated "" the",none,"In a 2014 interview , professor Matthew Abraham , author of Out of Bounds : Academic Freedom and the Question of Palestine , described the Finkelstein tenure case as "" one of the most significant academic freedom cases in the last fifty years "" , claiming","In a 2014 interview , professor Matthew Abraham , author of Out of Bounds : Academic Freedom and the Question of Palestine , described the Finkelstein tenure case as "" one of the most significant academic freedom cases in the last fifty years "" , claiming the case demonstrated "" the substantial pressure",38.05962634086609,7.5475616455078125
"In a 2014 interview , professor Matthew Abraham , author of Out of Bounds : Academic Freedom and the Question of Palestine , described the Finkelstein tenure case as "" one of the most significant academic freedom cases in the last fifty years "" , claiming the case demonstrated "" the substantial pressure outside parties can place on a mid @-@ tier religious institution when the perspectives advanced by a controversial scholar threaten dominant interests "".","In a 2014 interview , professor Matthew Abraham , author of Out of Bounds : Academic Freedom and the Question of Palestine , described the Finkelstein tenure case as "" one of the most significant academic freedom cases in the last fifty years "" , claiming the case demonstrated "" the substantial pressure outside parties can place on a mid @-@ tier religious institution when the perspectives advanced by a controversial scholar threaten dominant interests "".","In a 2014 interview , professor Matthew Abraham , author of Out of Bounds : Academic Freedom and the Question of Palestine , described the Finkelstein tenure case as "" one of the most significant academic freedom cases in the last fifty years "" , claiming the case",""" the substantial pressure outside parties can place on a mid @-@ tier religious institution when the perspectives advanced by a controversial scholar threaten dominant interests "".",0,demonstrate,demonstrated,"In a 2014 interview , professor Matthew Abraham , author of Out of Bounds : Academic Freedom and the Question of Palestine , described the Finkelstein tenure case as "" one of the most significant academic freedom cases in the last fifty years "" , claiming the case demonstrated "" the substantial pressure outside",none,"In a 2014 interview , professor Matthew Abraham , author of Out of Bounds : Academic Freedom and the Question of Palestine , described the Finkelstein tenure case as "" one of the most significant academic freedom cases in the last fifty years "" , claiming the case demonstrated","In a 2014 interview , professor Matthew Abraham , author of Out of Bounds : Academic Freedom and the Question of Palestine , described the Finkelstein tenure case as "" one of the most significant academic freedom cases in the last fifty years "" , claiming the case demonstrated "" the substantial pressure outside parties can",59.35833430290222,6.554113388061523
"In an interview with Haaretz , Finkelstein stated "" I did my best to provide absolutely candid and comprehensive answers to all the questions put to me.","In an interview with Haaretz , Finkelstein stated "" I did my best to provide absolutely candid and comprehensive answers to all the questions put to me.","In an interview with Haaretz , Finkelstein",""" I did my best to provide absolutely candid and comprehensive answers to all the questions put to me.",0,state,stated,"In an interview with Haaretz , Finkelstein stated "" I did my best",none,"In an interview with Haaretz , Finkelstein stated","In an interview with Haaretz , Finkelstein stated "" I did my best to provide",38.60962145589292,6.846310138702393
""" He had been travelling to visit friends in the West Bank and stated he had no interest in visiting Israel.",""" He had been travelling to visit friends in the West Bank and stated he had no interest in visiting Israel.",""" He had been travelling to visit friends in the West Bank and",he had no interest in visiting Israel.,0,state,stated,""" He had been travelling to visit friends in the West Bank and stated he had no interest in",none,""" He had been travelling to visit friends in the West Bank and stated",""" He had been travelling to visit friends in the West Bank and stated he had no interest in visiting Israel.",25.211247079074383,13.301945686340332
"Sfard said banning Finkelstein from entering the country "" recalls the behavior of the Soviet bloc countries "".","Sfard said banning Finkelstein from entering the country "" recalls the behavior of the Soviet bloc countries "".",Sfard,"banning Finkelstein from entering the country "" recalls the behavior of the Soviet bloc countries "".",0,say,said,Sfard said banning Finkelstein from entering the,none,Sfard said,"Sfard said banning Finkelstein from entering the country """,58.05013656616211,8.590299606323242
"According to Raul Hilberg , Finkelstein displays "" academic courage to speak the truth when no one else is out there to support him ... I would say that his place in the whole history of writing history is assured , and that those who in the end are proven right triumph , and he will be among those who will have triumphed , albeit , it so seems , at great cost.","According to Raul Hilberg , Finkelstein displays "" academic courage to speak the truth when no one else is out there to support him ... I would say his place in the whole history of writing history is assured , and that those who in the end are proven right triumph , and he will be among those who will have triumphed , albeit , it so seems , at great cost.","According to Raul Hilberg , Finkelstein displays "" academic courage to speak the truth when no one else is out there to support him ... I would","his place in the whole history of writing history is assured , and that those who in the end are proven right triumph , and he will be among those who will have triumphed , albeit , it so seems , at great cost.",0,say,say,"According to Raul Hilberg , Finkelstein displays "" academic courage to speak the truth when no one else is out there to support him ... I would say his place in the whole",that,"According to Raul Hilberg , Finkelstein displays "" academic courage to speak the truth when no one else is out there to support him ... I would say","According to Raul Hilberg , Finkelstein displays "" academic courage to speak the truth when no one else is out there to support him ... I would say his place in the whole history of",34.248404271900654,3.984069585800171
""" In a peer review for Beyond Chutzpah , Avi Shlaim said that Finkelstein "" has a most impressive track record in exposing spurious American @-@ Jewish scholarship on the Arab @-@ Israeli conflict.",""" In a peer review for Beyond Chutzpah , Avi Shlaim said Finkelstein "" has a most impressive track record in exposing spurious American @-@ Jewish scholarship on the Arab @-@ Israeli conflict.",""" In a peer review for Beyond Chutzpah , Avi Shlaim","Finkelstein "" has a most impressive track record in exposing spurious American @-@ Jewish scholarship on the Arab @-@ Israeli conflict.",0,say,said,""" In a peer review for Beyond Chutzpah , Avi Shlaim said Finkelstein "" has a most",that,""" In a peer review for Beyond Chutzpah , Avi Shlaim said",""" In a peer review for Beyond Chutzpah , Avi Shlaim said Finkelstein "" has a most impressive track",53.151777774095535,6.331909656524658
Sara Roy stated that her shared experience with Finkelstein as a child of Holocaust survivors engaged in research on the Palestinian @-@ Israeli conflict gave her a unique position to comment.,Sara Roy stated her shared experience with Finkelstein as a child of Holocaust survivors engaged in research on the Palestinian @-@ Israeli conflict gave her a unique position to comment.,Sara Roy,her shared experience with Finkelstein as a child of Holocaust survivors engaged in research on the Palestinian @-@ Israeli conflict gave her a unique position to comment.,0,state,stated,Sara Roy stated her shared experience with Finkelstein,that,Sara Roy stated,Sara Roy stated her shared experience with Finkelstein as a,55.27399230003357,13.32181453704834
Sara Roy stated that her shared experience with Finkelstein as a child of Holocaust survivors engaged in research on the Palestinian @-@ Israeli conflict gave her a unique position to comment.,Sara Roy stated her shared experience with Finkelstein as a child of Holocaust survivors engaged in research on the Palestinian @-@ Israeli conflict gave her a unique position to comment.,Sara Roy,her shared experience with Finkelstein as a child of Holocaust survivors engaged in research on the Palestinian @-@ Israeli conflict gave her a unique position to comment.,0,state,stated,Sara Roy stated her shared experience with Finkelstein,that,Sara Roy stated,Sara Roy stated her shared experience with Finkelstein as a,55.27399230003357,13.32181453704834
"The Israeli newspaper , Haaretz , stated that "" [ i ] t is difficult to sympathize with Finkelstein 's opinions and preferences , especially since he decided to support Hezbollah , meet with its fighters and visit the graves of some of its slain operatives.","The Israeli newspaper , Haaretz , stated "" [ i ] t is difficult to sympathize with Finkelstein 's opinions and preferences , especially since he decided to support Hezbollah , meet with its fighters and visit the graves of some of its slain operatives.","The Israeli newspaper , Haaretz ,",""" [ i ] t is difficult to sympathize with Finkelstein 's opinions and preferences , especially since he decided to support Hezbollah , meet with its fighters and visit the graves of some of its slain operatives.",0,state,stated,"The Israeli newspaper , Haaretz , stated "" [ i ] t",that,"The Israeli newspaper , Haaretz , stated","The Israeli newspaper , Haaretz , stated "" [ i ] t is difficult",47.77729943394661,7.324604034423828
""" Still , it continued to say that he should not be banned from entering Israel , because "" meetings with Hezbollah operatives do not in themselves constitute a security risk "".",""" Still , it continued to say he should not be banned from entering Israel , because "" meetings with Hezbollah operatives do not in themselves constitute a security risk "".",""" Still , it continued to","he should not be banned from entering Israel , because "" meetings with Hezbollah operatives do not in themselves constitute a security risk "".",0,say,say,""" Still , it continued to say he should not be banned",that,""" Still , it continued to say",""" Still , it continued to say he should not be banned from entering",34.71269392967224,8.469141006469727
"Daniel Goldhagen , whose book Hitler 's Willing Executioners Finkelstein criticized , claimed his scholarship has "" everything to do with his burning political agenda "".","Daniel Goldhagen , whose book Hitler 's Willing Executioners Finkelstein criticized , claimed his scholarship has "" everything to do with his burning political agenda "".","Daniel Goldhagen , whose book Hitler 's Willing Executioners Finkelstein criticized ,","his scholarship has "" everything to do with his burning political agenda "".",0,claim,claimed,"Daniel Goldhagen , whose book Hitler 's Willing Executioners Finkelstein criticized , claimed his scholarship has "" everything",none,"Daniel Goldhagen , whose book Hitler 's Willing Executioners Finkelstein criticized , claimed","Daniel Goldhagen , whose book Hitler 's Willing Executioners Finkelstein criticized , claimed his scholarship has "" everything to do",48.51686775684357,8.941001892089844
"Alan Dershowitz has written that Peter Novick , Professor of History at the University of Chicago and a noted Holocaust historian whose work Finkelstein says inspired The Holocaust Industry , has strongly criticized the latter 's work , describing it as "" trash "".","Alan Dershowitz has written Peter Novick , Professor of History at the University of Chicago and a noted Holocaust historian whose work Finkelstein says inspired The Holocaust Industry , has strongly criticized the latter 's work , describing it as "" trash "".",Alan Dershowitz has,"Peter Novick , Professor of History at the University of Chicago and a noted Holocaust historian whose work Finkelstein says inspired The Holocaust Industry , has strongly criticized the latter 's work , describing it as "" trash "".",0,write,written,"Alan Dershowitz has written Peter Novick , Professor of",that,Alan Dershowitz has written,"Alan Dershowitz has written Peter Novick , Professor of History at",59.88284212350845,4.123212814331055
"Chomsky selects the target and directs Finkelstein to probe the writings in minute detail and conclude that the writer didn 't actually write the work , that it is plagiarized , that it is a hoax and a fraud , "" arguing that Finkelstein has leveled charges against many academics , calling at least 10 "" distinguished Jews ' hucksters ' , ' hoaxters ' ( sic ) , ' thieves ' , ' extortionists ' , and worse.","Chomsky selects the target and directs Finkelstein to probe the writings in minute detail and conclude that the writer didn 't actually write the work , that it is plagiarized , that it is a hoax and a fraud , "" arguing Finkelstein has leveled charges against many academics , calling at least 10 "" distinguished Jews ' hucksters ' , ' hoaxters ' ( sic ) , ' thieves ' , ' extortionists ' , and worse.","Chomsky selects the target and directs Finkelstein to probe the writings in minute detail and conclude that the writer didn 't actually write the work , that it is plagiarized , that it is a hoax and a fraud , ""","Finkelstein has leveled charges against many academics , calling at least 10 "" distinguished Jews ' hucksters ' , ' hoaxters ' ( sic ) , ' thieves ' , ' extortionists ' , and worse.",0,argue,arguing,"Chomsky selects the target and directs Finkelstein to probe the writings in minute detail and conclude that the writer didn 't actually write the work , that it is plagiarized , that it is a hoax and a fraud , "" arguing Finkelstein has leveled charges against",that,"Chomsky selects the target and directs Finkelstein to probe the writings in minute detail and conclude that the writer didn 't actually write the work , that it is plagiarized , that it is a hoax and a fraud , "" arguing","Chomsky selects the target and directs Finkelstein to probe the writings in minute detail and conclude that the writer didn 't actually write the work , that it is plagiarized , that it is a hoax and a fraud , "" arguing Finkelstein has leveled charges against many academics",54.94196758419275,13.504234313964844
""" Although the back and forth between Finkelstein and Dershowitz received the most attention and attracted significant controversy , Finkelstein has maintained that "" the real issue is Israel 's human rights record.",""" Although the back and forth between Finkelstein and Dershowitz received the most attention and attracted significant controversy , Finkelstein has maintained "" the real issue is Israel 's human rights record.",""" Although the back and forth between Finkelstein and Dershowitz received the most attention and attracted significant controversy , Finkelstein has",""" the real issue is Israel 's human rights record.",0,maintain,maintained,""" Although the back and forth between Finkelstein and Dershowitz received the most attention and attracted significant controversy , Finkelstein has maintained "" the real issue is",that,""" Although the back and forth between Finkelstein and Dershowitz received the most attention and attracted significant controversy , Finkelstein has maintained",""" Although the back and forth between Finkelstein and Dershowitz received the most attention and attracted significant controversy , Finkelstein has maintained "" the real issue is Israel 's",50.184456408023834,3.997607946395874
"Finkelstein says that Goldberg admits to personally sending prisoners to the zinzana , which he says has been repeatedly condemned as torture in human rights reports.","Finkelstein says Goldberg admits to personally sending prisoners to the zinzana , which he says has been repeatedly condemned as torture in human rights reports.",Finkelstein,"Goldberg admits to personally sending prisoners to the zinzana , which he says has been repeatedly condemned as torture in human rights reports.",0,say,says,Finkelstein says Goldberg admits to personally sending,that,Finkelstein says,Finkelstein says Goldberg admits to personally sending prisoners to,64.10960233211517,5.189193248748779
""" Goldberg said his "" principal role "" was "" making sure prisoners had fresh fruit.",""" Goldberg said his "" principal role "" was "" making sure prisoners had fresh fruit.",""" Goldberg","his "" principal role "" was "" making sure prisoners had fresh fruit.",0,say,said,""" Goldberg said his "" principal role """,none,""" Goldberg said",""" Goldberg said his "" principal role "" was """,46.81638264656067,8.543218612670898
"Discussing Finkelstein 's book Beyond Chutzpah , Israeli historian Avi Shlaim stated that Finkelstein 's critique of Israel "" is based on an amazing amount of research.","Discussing Finkelstein 's book Beyond Chutzpah , Israeli historian Avi Shlaim stated Finkelstein 's critique of Israel "" is based on an amazing amount of research.","Discussing Finkelstein 's book Beyond Chutzpah , Israeli historian Avi Shlaim","Finkelstein 's critique of Israel "" is based on an amazing amount of research.",0,state,stated,"Discussing Finkelstein 's book Beyond Chutzpah , Israeli historian Avi Shlaim stated Finkelstein 's critique of Israel",that,"Discussing Finkelstein 's book Beyond Chutzpah , Israeli historian Avi Shlaim stated","Discussing Finkelstein 's book Beyond Chutzpah , Israeli historian Avi Shlaim stated Finkelstein 's critique of Israel "" is",44.35768948938494,6.820131301879883
"I think Israel , as a number of commentators pointed out , is becoming an insane state.","I think Israel , as a number of commentators pointed out , is becoming an insane state.",I,"Israel , as a number of commentators pointed out , is becoming an insane state.",0,think,think,"I think Israel , as a number",none,I think,"I think Israel , as a number of commentators",52.011807948350906,4.997169494628906
"That said , sometimes I feel that Israel has come out of the boils ( sic ) of the hell , a satanic state.","That said , sometimes I feel Israel has come out of the boils ( sic ) of the hell , a satanic state.","That said , sometimes I","Israel has come out of the boils ( sic ) of the hell , a satanic state.",0,feel,feel,"That said , sometimes I feel Israel has come out of",that,"That said , sometimes I feel","That said , sometimes I feel Israel has come out of the boils",60.31620633602142,3.7355074882507324
""" On being called an anti @-@ Zionist Finkelstein has said : "" It 's a superficial term.",""" On being called an anti @-@ Zionist Finkelstein has said : "" It 's a superficial term.",""" On being called an anti @-@ Zionist Finkelstein has",": "" It 's a superficial term.",0,say,said,""" On being called an anti @-@ Zionist Finkelstein has said : "" It 's a",none,""" On being called an anti @-@ Zionist Finkelstein has said",""" On being called an anti @-@ Zionist Finkelstein has said : "" It 's a superficial term.",52.86482501029968,5.084182366728783
"Finkelstein has expressed solidarity with Hezbollah and Hamas with respect to defensive actions , alleging that Israel had invaded Lebanon as a signal of rejection when Hamas was seeking a diplomatic settlement with Israel.","Finkelstein has expressed solidarity with Hezbollah and Hamas with respect to defensive actions , alleging Israel had invaded Lebanon as a signal of rejection when Hamas was seeking a diplomatic settlement with Israel.","Finkelstein has expressed solidarity with Hezbollah and Hamas with respect to defensive actions ,",Israel had invaded Lebanon as a signal of rejection when Hamas was seeking a diplomatic settlement with Israel.,0,allege,alleging,"Finkelstein has expressed solidarity with Hezbollah and Hamas with respect to defensive actions , alleging Israel had invaded Lebanon as",that,"Finkelstein has expressed solidarity with Hezbollah and Hamas with respect to defensive actions , alleging","Finkelstein has expressed solidarity with Hezbollah and Hamas with respect to defensive actions , alleging Israel had invaded Lebanon as a signal",40.85920590162277,11.825328826904297
"I have no problem saying that I do want to express solidarity with them , and I am not going to be a coward of ( sic ) a hypocrite about it.","I have no problem saying I do want to express solidarity with them , and I am not going to be a coward of ( sic ) a hypocrite about it.",I have no problem,"I do want to express solidarity with them , and I am not going to be a coward of ( sic ) a hypocrite about it.",0,say,saying,I have no problem saying I do want to express,that,I have no problem saying,I have no problem saying I do want to express solidarity with,35.94628158211708,6.588740348815918
"While condemning the targeting of civilians to achieve a political goal , Finkelstein has stated he believes Hezbollah has the right to target Israeli civilians as long as "" Israel persists in targeting [ Lebanese ] civilians until Israel ceases its terrorist acts.","While condemning the targeting of civilians to achieve a political goal , Finkelstein has stated he believes Hezbollah has the right to target Israeli civilians as long as "" Israel persists in targeting [ Lebanese ] civilians until Israel ceases its terrorist acts.","While condemning the targeting of civilians to achieve a political goal , Finkelstein has","he believes Hezbollah has the right to target Israeli civilians as long as "" Israel persists in targeting [ Lebanese ] civilians until Israel ceases its terrorist acts.",0,state,stated,"While condemning the targeting of civilians to achieve a political goal , Finkelstein has stated he believes Hezbollah has the",none,"While condemning the targeting of civilians to achieve a political goal , Finkelstein has stated","While condemning the targeting of civilians to achieve a political goal , Finkelstein has stated he believes Hezbollah has the right to",29.344092458486557,6.542627334594727
"While condemning the targeting of civilians to achieve a political goal , Finkelstein has stated he believes Hezbollah has the right to target Israeli civilians as long as "" Israel persists in targeting [ Lebanese ] civilians until Israel ceases its terrorist acts.","While condemning the targeting of civilians to achieve a political goal , Finkelstein has stated he believes Hezbollah has the right to target Israeli civilians as long as "" Israel persists in targeting [ Lebanese ] civilians until Israel ceases its terrorist acts.","While condemning the targeting of civilians to achieve a political goal , Finkelstein has stated he","Hezbollah has the right to target Israeli civilians as long as "" Israel persists in targeting [ Lebanese ] civilians until Israel ceases its terrorist acts.",0,believe,believes,"While condemning the targeting of civilians to achieve a political goal , Finkelstein has stated he believes Hezbollah has the right to",none,"While condemning the targeting of civilians to achieve a political goal , Finkelstein has stated he believes","While condemning the targeting of civilians to achieve a political goal , Finkelstein has stated he believes Hezbollah has the right to target Israeli",29.586227029561996,2.90028715133667
